Symbol,Name,Last Sale,Net Change,% Change,Market Cap,Country,IPO Year,Volume,Sector,Industry
QQQX,Nuveen NASDAQ 100 Dynamic Overwrite Fund Shares of Beneficial Interest,$23.28,-0.215,-0.915%,1094610258.00,United States,,12895,Finance,Finance Companies
QRHC,Quest Resource Holding Corporation Common Stock,$7.09,-0.05,-0.70%,140066573.00,United States,,441,Consumer Discretionary,Building Products
QRTEA,Qurate Retail Inc. Series A Common Stock ,$2.30,-0.06,-2.542%,879086772.00,United States,,465116,Consumer Discretionary,Catalog/Specialty Distribution
QRTEB,Qurate Retail Inc. Series B Common Stock ,$5.36,0.00,0.00%,2048654390.00,United States,,4,Consumer Discretionary,Catalog/Specialty Distribution
QRTEP,Qurate Retail Inc. 8.0% Fixed Rate Cumulative Redeemable Preferred Stock,$49.50,0.21,0.426%,0.00,United States,,10185,Consumer Discretionary,Catalog/Specialty Distribution
QRVO,Qorvo Inc. Common Stock,$103.07,-1.37,-1.312%,10295580875.00,United States,,45431,Industrials,Industrial Machinery/Components
QSG,QuantaSing Group Limited American Depositary Shares,$12.70,-0.10,-0.781%,699500201.00,China,2023,703,Real Estate,Other Consumer Services
QSI,Quantum-Si Incorporated Class A Common Stock,$1.99,-0.03,-1.485%,278239800.00,United States,2020,149249,Health Care,Biotechnology: Pharmaceutical Preparations
QSIAW,Quantum-Si Incorporated Warrant,$0.3749,0.0285,8.227%,0.00,United States,2020,200,Health Care,Biotechnology: Pharmaceutical Preparations
QTEK,QualTek Services Inc. Class A Common Stock,$0.4169,-0.0274,-6.167%,11592179.00,United States,2021,58028,Consumer Discretionary,Telecommunications Equipment
QTEKW,QualTek Services Inc. Warrant,$0.0321,0.00,0.00%,0.00,United States,2021,1501,Consumer Discretionary,Telecommunications Equipment
QTRX,Quanterix Corporation Common Stock,$13.17,-0.12,-0.903%,488010465.00,United States,2017,17308,Health Care,Industrial Specialties
QTT,Qutoutiao Inc. American Depositary Shares,$0.86,-0.0157,-1.793%,24911055.00,China,2018,120,Technology,Computer Software: Prepackaged Software
QUBT,Quantum Computing Inc. Common Stock,$1.59,-0.01,-0.625%,84749870.00,United States,,57407,Technology,Computer Manufacturing
QUIK,QuickLogic Corporation Common Stock,$5.825,0.00,0.00%,76380546.00,United States,1999,5,Technology,Semiconductors
QURE,uniQure N.V. Ordinary Shares,$19.92,-0.24,-1.19%,932556971.00,Netherlands,2014,8671,Health Care,Biotechnology: Pharmaceutical Preparations
RADI,Radius Global Infrastructure Inc. Class A Common Stock,$13.93,-0.01,-0.072%,1327300033.00,United States,,39159,Consumer Discretionary,Telecommunications Equipment
RAIL,FreightCar America Inc. Common Stock,$3.94,0.04,1.026%,67859826.00,United States,2005,5153,Industrials,Railroads
RAIN,Rain Oncology Inc. Common Stock,$9.21,-0.31,-3.256%,323650047.00,United States,2021,31948,Health Care,Biotechnology: Pharmaceutical Preparations
RAM,Aries I Acquisition Corporation Class A Ordinary Share,$10.47,-0.01,-0.095%,61666290.00,Cayman Islands,2021,312,Finance,Blank Checks
RAMMU,Aries I Acquisition Corporation Unit,$10.50,0.04,0.382%,0.00,Cayman Islands,2021,5219,Finance,Blank Checks
RAMMW,Aries I Acquisition Corporation Warrant,$0.0764,0.0175,29.711%,0.00,Cayman Islands,2021,699,Finance,Blank Checks
RAND,Rand Capital Corporation Common Stock,$13.95,0.00,0.00%,36005243.00,United States,,2,Finance,Finance/Investors Services
RANI,Rani Therapeutics Holdings Inc. Class A Common Stock,$5.0501,-0.5099,-9.171%,255248411.00,United States,2021,7450,Health Care, Medicinal Chemicals and Botanical Products 
RAPT,RAPT Therapeutics Inc. Common Stock,$28.185,0.545,1.972%,957300904.00,United States,2019,24546,Health Care,Biotechnology: Pharmaceutical Preparations
RARE,Ultragenyx Pharmaceutical Inc. Common Stock,$46.24,1.97,4.45%,3241685441.00,United States,2014,56052,Health Care,Biotechnology: Pharmaceutical Preparations
RAVE,Rave Restaurant Group Inc. Common Stock,$1.5881,0.0181,1.153%,22478687.00,United States,,3853,Consumer Discretionary,Restaurants
RAYA,Erayak Power Solution Group Inc. Class A Ordinary Shares,$2.84,0.00,0.00%,34080000.00,China,2022,36,,
RBB,RBB Bancorp Common Stock,$19.65,-0.16,-0.808%,372677498.00,United States,2017,5294,Finance,Commercial Banks
RBBN,Ribbon Communications Inc. Common Stock,$4.57,-0.06,-1.296%,768322444.00,United States,,69396,Technology,EDP Services
RBCAA,Republic Bancorp Inc. Class A Common Stock,$45.95,0.20,0.437%,907367068.00,United States,1998,3189,Finance,Major Banks
RBKB,Rhinebeck Bancorp Inc. Common Stock,$9.50,-0.0501,-0.525%,107203368.00,United States,2019,110,Finance,Major Banks
RCACW,Revelstone Capital Acquisition Corp. Warrant,$0.0915,-0.0283,-23.623%,0.00,United States,2022,42627,Industrials,Consumer Electronics/Appliances
RCAT,Red Cat Holdings Inc. Common Stock,$1.22,-0.01,-0.813%,66257656.00,United States,,8925,Industrials,Wholesale Distributors
RCEL,Avita Medical Inc. Common Stock,$9.46,-0.15,-1.561%,236792333.00,United States,,342,Health Care,Medical Specialities
RCII,Rent-A-Center Inc. Common Stock,$28.03,-0.25,-0.884%,1560431445.00,United States,1995,37011,Consumer Discretionary,Diversified Commercial Services
RCKT,Rocket Pharmaceuticals Inc. Common Stock,$18.70,-0.35,-1.837%,1472232674.00,United States,2015,43820,Health Care,Biotechnology: Pharmaceutical Preparations
RCKY,Rocky Brands Inc. Common Stock,$28.33,0.11,0.39%,207557224.00,United States,1993,2425,Consumer Discretionary,Shoe Manufacturing
RCLF,Rosecliff Acquisition Corp I Class A Common Stock,$10.0601,0.00,0.00%,318150663.00,United States,2021,5,Industrials,Consumer Electronics/Appliances
RCLFW,Rosecliff Acquisition Corp I Warrants,$0.0801,0.00,0.00%,0.00,United States,2021,8830,Industrials,Consumer Electronics/Appliances
RCM,R1 RCM Inc. Common Stock,$14.23,-0.34,-2.334%,5926949509.00,United States,,278736,Consumer Discretionary,Other Consumer Services
RCMT,RCM Technologies Inc. Common Stock,$13.83,-0.13,-0.931%,136111596.00,United States,,2710,Industrials,Consumer Electronics/Appliances
RCON,Recon Technology Ltd. Class A Ordinary Shares,$1.575,-0.025,-1.563%,11344460.00,China,2009,7874,Energy,Oilfield Services/Equipment
RCRT,Recruiter.com Group Inc. Common Stock,$0.40,0.00,0.00%,6511106.00,United States,,33698,Technology,Interactive Media
RDCM,Radcom Ltd. Ordinary Shares,$10.21,-0.19,-1.827%,147899916.00,Israel,1997,5789,Technology,Computer peripheral equipment
RDFN,Redfin Corporation Common Stock,$8.97,-0.04,-0.444%,975476000.00,United States,2017,1198488,Finance,Real Estate
RDHL,Redhill Biopharma Ltd. American Depositary Shares,$0.2245,-0.0025,-1.101%,20475305.00,Israel,,750265,Health Care,Biotechnology: Pharmaceutical Preparations
RDI,Reading International Inc Class A Common Stock,$3.54,0.03,0.855%,78035137.00,United States,,12603,Consumer Discretionary,Movies/Entertainment
RDIB,Reading International Inc Class B Common Stock,$20.85,0.00,0.00%,459613730.00,United States,,1,Consumer Discretionary,Movies/Entertainment
RDNT,RadNet Inc. Common Stock,$21.20,0.04,0.189%,1216050020.00,United States,,22501,Health Care,Medical Specialities
RDVT,Red Violet Inc. Common Stock ,$21.90,0.59,2.769%,304274286.00,United States,,3901,Technology,Computer Software: Prepackaged Software
RDWR,Radware Ltd. Ordinary Shares,$21.29,0.13,0.614%,954659972.00,Israel,1999,4041,Technology,EDP Services
REAL,The RealReal Inc. Common Stock,$1.60,-0.01,-0.621%,156905248.00,United States,2019,424254,Consumer Discretionary,Consumer Specialties
REAX,The Real Brokerage Inc. Common Shares,$1.3986,-0.0214,-1.507%,250142179.00,Canada,,3687,,
REBN,Reborn Coffee Inc. Common Stock,$1.00,0.0034,0.341%,13119523.00,United States,2022,4346,Consumer Discretionary,Restaurants
REE,REE Automotive Ltd. Class A Ordinary Shares,$0.4502,-0.0243,-5.121%,109736512.00,Israel,,13852,Consumer Discretionary,Auto Manufacturing
REFI,Chicago Atlantic Real Estate Finance Inc. Common Stock,$14.93,0.00,0.00%,263632641.00,United States,2021,4047,Real Estate,Real Estate Investment Trusts
REFR,Research Frontiers Incorporated Common Stock,$1.9199,0.00,0.00%,63645445.00,United States,,7,Technology,Industrial Machinery/Components
REG,Regency Centers Corporation Common Stock,$64.32,-0.28,-0.433%,10977280536.00,United States,1993,39436,Real Estate,Real Estate Investment Trusts
REGN,Regeneron Pharmaceuticals Inc. Common Stock,$744.87,8.54,1.16%,81433309021.00,United States,1991,37448,Health Care,Biotechnology: Pharmaceutical Preparations
REKR,Rekor Systems Inc. Common Stock,$1.94,0.00,0.00%,105434249.00,United States,,10836,Technology,EDP Services
RELI,Reliance Global Group Inc. Common Stock,$0.5649,-0.0023,-0.406%,10198970.00,United States,,7964,Finance,Specialty Insurers
RELIW,Reliance Global Group Inc. Series A Warrants,$0.1206,-0.0075,-5.855%,0.00,United States,,1637,Finance,Specialty Insurers
RELL,Richardson Electronics Ltd. Common Stock,$23.7872,-0.3728,-1.543%,334797323.00,United States,1983,17529,Technology,Electronic Components
RELY,Remitly Global Inc. Common Stock,$11.62,-0.44,-3.648%,1983113391.00,United States,2021,113479,Technology,Computer Software: Prepackaged Software
RENE,Cartesian Growth Corporation II Class A Ordinary Shares,$10.41,0.00,0.00%,299287500.00,United States,2022,51435,Finance,Blank Checks
RENEW,Cartesian Growth Corporation II Warrant,$0.20,-0.0001,-0.05%,0.00,United States,2022,46576,Finance,Blank Checks
RENT,Rent the Runway Inc. Class A Common Stock,$3.915,-0.065,-1.633%,254564211.00,United States,2021,50925,Consumer Discretionary,Department/Specialty Retail Stores
REPL,Replimune Group Inc. Common Stock,$24.225,-0.035,-0.144%,1372466745.00,United States,2018,30542,Health Care,Biotechnology: Pharmaceutical Preparations
RETA,Reata Pharmaceuticals Inc. Class A Common Stock,$44.19,1.50,3.514%,1619283114.00,United States,2016,129462,Health Care,Biotechnology: Pharmaceutical Preparations
RETO,ReTo Eco-Solutions Inc. Common Shares,$0.35,-0.008,-2.235%,15087839.00,China,2017,1790,Consumer Discretionary,Multi-Sector Companies
REUN,Reunion Neuroscience Inc. Common Shares,$1.23,0.05,4.237%,14323537.00,Canada,,544,Health Care,Pharmaceuticals and Biotechnology
REVB,Revelation Biosciences Inc. Common Stock,$2.6093,-0.0307,-1.163%,9291874.00,United States,2020,28977,Health Care,Biotechnology: Pharmaceutical Preparations
REVBW,Revelation Biosciences Inc. Warrant,$0.0262,0.00,0.00%,0.00,United States,2020,8437,Health Care,Biotechnology: Pharmaceutical Preparations
REVE,Alpine Acquisition Corporation Common Stock,$10.52,0.005,0.048%,142546000.00,United States,2021,246752,Industrials,Consumer Electronics/Appliances
REVEU,Alpine Acquisition Corporation Unit,$10.52,0.00,0.00%,0.00,United States,2021,499,Industrials,Consumer Electronics/Appliances
REVEW,Alpine Acquisition Corporation Warrant,$0.12,0.00,0.00%,0.00,United States,2021,3348,Industrials,Consumer Electronics/Appliances
REYN,Reynolds Consumer Products Inc. Common Stock,$27.91,0.18,0.649%,5857266785.00,United States,2020,7248,Industrials,Office Equipment/Supplies/Services
RFAC,RF Acquisition Corp. Class A Common Stock,$10.22,0.00,0.00%,148956500.00,Singapore,2022,441,Industrials,Consumer Electronics/Appliances
RFACU,RF Acquisition Corp. Unit,$10.31,0.04,0.389%,0.00,Singapore,2022,100,Industrials,Consumer Electronics/Appliances
RFACW,RF Acquisition Corp. Warrants,$0.0225,0.00,0.00%,0.00,Singapore,2022,280,Industrials,Consumer Electronics/Appliances
RFIL,RF Industries Ltd. Common Stock,$5.40,0.00,0.00%,55043750.00,United States,,1,Technology,Electrical Products
RGC,Regencell Bioscience Holdings Limited Ordinary Shares,$27.05,-0.99,-3.531%,351998025.00,Hong Kong,2021,202,Health Care, Medicinal Chemicals and Botanical Products 
RGCO,RGC Resources Inc. Common Stock,$24.30,0.00,0.00%,240830763.00,United States,,61,Utilities,Oil & Gas Production
RGEN,Repligen Corporation Common Stock,$195.0499,-3.0501,-1.54%,10830036275.00,United States,1986,49624,Health Care,Medical/Dental Instruments
RGF,The Real Good Food Company Inc. Class A Common Stock,$4.83,-0.07,-1.429%,124360744.00,United States,2021,8167,Consumer Discretionary,Food Distributors
RGLD,Royal Gold Inc. Common Stock,$119.81,-2.95,-2.403%,7864772895.00,United States,,22315,Industrials,Consumer Electronics/Appliances
RGLS,Regulus Therapeutics Inc. Common Stock,$1.29,0.00,0.00%,21723937.00,United States,2012,1897,Health Care,Biotechnology: Pharmaceutical Preparations
RGNX,REGENXBIO Inc. Common Stock,$21.13,-0.06,-0.283%,914794423.00,United States,2015,26405,Health Care,Biotechnology: Biological Products (No Diagnostic Substances)
RGP,Resources Connection Inc. Common Stock,$18.24,-0.02,-0.11%,613489212.00,United States,,20516,Consumer Discretionary,Business Services
RGTI,Rigetti Computing Inc. Common Stock,$1.079,-0.041,-3.661%,132749428.00,United States,,125007,Technology,Retail: Computer Software & Peripheral Equipment
RGTIW,Rigetti Computing Inc. Warrants,$0.15,-0.02,-11.765%,0.00,United States,,1000,Technology,Retail: Computer Software & Peripheral Equipment
RIBT,RiceBran Technologies Common Stock,$1.193,-0.057,-4.56%,7446798.00,United States,,1852,Consumer Staples,Specialty Foods
RICK,RCI Hospitality Holdings Inc. Common Stock,$86.54,-0.86,-0.984%,798783672.00,United States,1995,9383,Consumer Discretionary,Restaurants
RIDE,Lordstown Motors Corp. Class A Common Stock,$1.29,-0.01,-0.769%,296562640.00,United States,2019,162170,Consumer Discretionary,Construction/Ag Equipment/Trucks
RIGL,Rigel Pharmaceuticals Inc. Common Stock,$1.5697,-0.0203,-1.277%,271301197.00,United States,2000,136764,Health Care,Biotechnology: Pharmaceutical Preparations
RILY,B. Riley Financial Inc. Common Stock,$43.47,-0.44,-1.002%,1236599132.00,United States,,53268,Finance,Investment Managers
RILYG,B. Riley Financial Inc. 5.00% Senior Notes due 2026,$19.95,-0.04,-0.20%,0.00,United States,,1318,Consumer Discretionary,Business Services
RILYK,B. Riley Financial Inc. 5.50% Senior Notes Due 2026,$21.17,0.00,0.00%,0.00,United States,,75,Consumer Discretionary,Business Services
RILYL,B. Riley Financial Inc. Depositary Shares each representing 1/1000th in a share of 7.375% Series B Cumulative Perpetual Preferred Stock par value $0.0001,$24.08,-0.02,-0.083%,0.00,United States,,200,Finance,Investment Managers
RILYM,B. Riley Financial Inc. 6.375% Senior Notes due 2025,$22.73,-0.07,-0.307%,0.00,United States,,13135,Consumer Discretionary,Business Services
RILYN,B. Riley Financial Inc. 6.50% Senior Notes Due 2026,$21.34,-0.03,-0.14%,0.00,United States,,600,Consumer Discretionary,Business Services
RILYO,B. Riley Financial Inc. 6.75% Senior Notes due 2024,$23.64,-0.11,-0.463%,0.00,United States,,1176,Consumer Discretionary,Business Services
RILYP,B. Riley Financial Inc. Depositary Shares each representing a 1/1000th fractional interest in a share of Series A Cumulative Perpetual Preferred Stock,$21.15,-0.07,-0.33%,0.00,United States,,795,Finance,Investment Managers
RILYT,B. Riley Financial Inc. 6.00% Senior Notes Due 2028,$19.51,-0.096,-0.49%,0.00,United States,,807,Consumer Discretionary,Business Services
RILYZ,B. Riley Financial Inc. 5.25% Senior Notes due 2028,$18.00,-0.15,-0.826%,0.00,United States,,7637,Consumer Discretionary,Business Services
RIOT,Riot Platforms Inc. Common Stock ,$6.2699,-0.0901,-1.417%,1048934902.00,United States,,2504240,Technology,Retail: Computer Software & Peripheral Equipment
RIVN,Rivian Automotive Inc. Class A Common Stock,$19.9258,-0.7542,-3.647%,18350781179.00,United States,2021,2253747,Consumer Discretionary,Auto Manufacturing
RKDA,Arcadia Biosciences Inc. Common Stock,$0.2611,-0.0087,-3.225%,6434277.00,United States,2015,7082,Consumer Staples,Farming/Seeds/Milling
RKLB,Rocket Lab USA Inc. Common Stock,$4.805,-0.165,-3.32%,2274000803.00,United States,2020,538196,Industrials,Aerospace
RLAY,Relay Therapeutics Inc. Common Stock,$17.52,0.07,0.401%,2118078666.00,United States,2020,56815,Health Care,Biotechnology: Pharmaceutical Preparations
RLMD,Relmada Therapeutics Inc. Common Stock,$3.64,0.08,2.247%,109561099.00,United States,,18472,Health Care,Biotechnology: Pharmaceutical Preparations
RLYB,Rallybio Corporation Common Stock,$6.99,0.07,1.012%,264489626.00,United States,2021,6106,Health Care,Biotechnology: Pharmaceutical Preparations
RMBI,Richmond Mutual Bancorporation Inc. Common Stock,$13.42,-0.13,-0.959%,158141280.00,United States,2019,3581,,
RMBL,RumbleOn Inc. Class B Common Stock,$8.34,-0.37,-4.248%,135055333.00,United States,,6609,Consumer Discretionary,Automotive Aftermarket
RMBS,Rambus Inc. Common Stock,$44.88,-0.14,-0.311%,4823792609.00,United States,1997,51715,Technology,Semiconductors
RMCF,Rocky Mountain Chocolate Factory Inc. Common Stock,$5.00,0.00,0.00%,31251485.00,United States,,5,Consumer Staples,Specialty Foods
RMGC,RMG Acquisition Corp. III Class A Ordinary Shares,$10.02,0.02,0.20%,604957500.00,United States,2021,12162,Finance,Blank Checks
RMGCU,RMG Acquisition Corp. III Unit,$10.0043,-0.0157,-0.157%,0.00,United States,2021,43478,Finance,Blank Checks
RMGCW,RMG Acquisition Corp. III Warrant,$0.1305,0.00,0.00%,0.00,United States,2021,620,Finance,Blank Checks
RMNI,Rimini Street Inc. (DE) Common Stock,$4.92,0.04,0.82%,434327760.00,United States,2015,22906,Technology,EDP Services
RMR,The RMR Group Inc. Class A Common Stock,$30.15,0.30,1.005%,500588349.00,United States,,9107,Finance,Real Estate
RMTI,Rockwell Medical Inc. Common Stock,$2.5299,-0.0201,-0.788%,29429499.00,United States,1998,15242,Health Care,Biotechnology: Pharmaceutical Preparations
RNA,Avidity Biosciences Inc. Common Stock,$23.94,-0.19,-0.787%,1591112681.00,United States,2020,36330,Health Care,Biotechnology: Pharmaceutical Preparations
RNAZ,TransCode Therapeutics Inc. Common Stock,$0.5236,0.0193,3.827%,6794880.00,United States,2021,175212,Health Care,Biotechnology: Pharmaceutical Preparations
RNER,Mount Rainier Acquisition Corp. Common Stock,$8.75,-0.34,-3.74%,66700393.00,United States,2022,946,Industrials,Consumer Electronics/Appliances
RNERW,Mount Rainier Acquisition Corp. Warrant,$0.20,-0.03,-13.043%,0.00,United States,2022,4196,Industrials,Consumer Electronics/Appliances
RNLX,Renalytix plc American Depositary Shares,$3.27,-0.05,-1.506%,153060205.00,United Kingdom,2020,1106,Health Care,Medical Specialities
RNST,Renasant Corporation Common Stock,$37.39,-0.18,-0.479%,2092086559.00,United States,,16197,Finance,Major Banks
RNW,ReNew Energy Global plc Class A Ordinary Shares,$5.58,-0.25,-4.288%,2162045024.00,United Kingdom,,46184,Utilities,Electric Utilities: Central
RNWWW,ReNew Energy Global plc Warrant,$0.78,-0.02,-2.50%,0.00,United Kingdom,,7091,Utilities,Electric Utilities: Central
RNXT,RenovoRx Inc. Common Stock,$4.1001,0.0141,0.345%,37301484.00,United States,2021,6108,Health Care,Biotechnology: Pharmaceutical Preparations
ROAD,Construction Partners Inc. Class A Common Stock,$29.605,0.065,0.22%,1560805471.00,United States,2018,17193,Industrials,Engineering & Construction
ROC,ROC Energy Acquisition Corp. Common Stock,$10.36,0.01,0.097%,278176360.00,United States,2021,63035,Industrials,Consumer Electronics/Appliances
ROCAR,ROC Energy Acquisition Corp. Rights,$0.3207,-0.0268,-7.712%,0.00,United States,2021,160026,Industrials,Consumer Electronics/Appliances
ROCAU,ROC Energy Acquisition Corp. Unit,$10.65,-0.0601,-0.561%,0.00,United States,2021,7745,Industrials,Consumer Electronics/Appliances
ROCC,Ranger Oil Corporation Class A Common Stock,$40.61,-1.94,-4.559%,775254606.00,United States,,38357,Energy,Oil & Gas Production
ROCG,Roth CH Acquisition IV Co. Common Stock,$10.40,0.00,0.00%,59433390.00,United States,2021,8,Industrials,Consumer Electronics/Appliances
ROCGW,Roth CH Acquisition IV Co. Warrant,$0.241,0.001,0.417%,0.00,United States,2021,40000,Industrials,Consumer Electronics/Appliances
ROCK,Gibraltar Industries Inc. Common Stock,$55.76,-0.12,-0.215%,1726941399.00,United States,1993,13389,,
ROCL,Roth CH Acquisition V Co. Common Stock,$10.23,0.00,0.00%,151777395.00,United States,2022,302,Industrials,Consumer Electronics/Appliances
ROCLW,Roth CH Acquisition V Co. Warrant,$0.0479,-0.0152,-24.089%,0.00,United States,2022,2302,Industrials,Consumer Electronics/Appliances
ROIC,Retail Opportunity Investments Corp. Common Stock (MD),$14.73,0.00,0.00%,1834456686.00,United States,,97758,Real Estate,Real Estate Investment Trusts
ROIV,Roivant Sciences Ltd. Common Shares,$8.60,-0.13,-1.489%,6522475210.00,United Kingdom,,53682,Health Care,Biotechnology: Pharmaceutical Preparations
ROIVW,Roivant Sciences Ltd. Warrant,$2.05,-0.01,-0.485%,0.00,United Kingdom,,5000,Health Care,Biotechnology: Pharmaceutical Preparations
ROKU,Roku Inc. Class A Common Stock,$71.235,0.665,0.942%,9920863972.00,United States,2017,2408497,Telecommunications,Cable & Other Pay Television Services
ROOT,Root Inc. Class A Common Stock,$6.545,-0.115,-1.727%,92284500.00,United States,2020,7600,Finance,Property-Casualty Insurers
ROSE,Rose Hill Acquisition Corporation Class A Ordinary Shares,$10.35,0.03,0.291%,200854688.00,United States,2021,5656,Finance,Blank Checks
ROSEW,Rose Hill Acquisition Corporation Warrant,$0.1482,0.0072,5.106%,0.00,United States,2021,5378,Finance,Blank Checks
ROST,Ross Stores Inc. Common Stock,$115.735,0.415,0.36%,39855778727.00,United States,1985,120640,Consumer Discretionary,Clothing/Shoe/Accessory Stores
ROVR,Rover Group Inc. Class A Common Stock,$3.97,-0.01,-0.251%,729500073.00,United States,2021,38506,Consumer Discretionary,Other Consumer Services
RPAY,Repay Holdings Corporation Class A Common Stock,$8.83,-0.15,-1.67%,800784532.00,United States,2018,59161,Technology,EDP Services
RPD,Rapid7 Inc. Common Stock,$47.87,-1.01,-2.066%,2835623490.00,United States,2015,41447,Technology,Computer Software: Prepackaged Software
RPHM,Reneo Pharmaceuticals Inc. Common Stock,$3.02,0.11,3.78%,74079531.00,United States,2021,4896,Health Care,Biotechnology: Pharmaceutical Preparations
RPID,Rapid Micro Biosystems Inc. Class A Common Stock,$1.28,0.00,0.00%,53752685.00,United States,2021,44,Health Care,Medical Specialities
RPRX,Royalty Pharma plc Class A Ordinary Shares ,$37.39,0.15,0.403%,16569977862.00,United States,2020,72956,Health Care,Biotechnology: Pharmaceutical Preparations
RPTX,Repare Therapeutics Inc. Common Shares,$10.905,-0.105,-0.954%,457590267.00,Canada,2020,8958,Health Care,Pharmaceuticals and Biotechnology
RRBI,Red River Bancshares Inc. Common Stock,$50.98,0.03,0.059%,366235987.00,United States,2019,1489,Finance,Commercial Banks
RRGB,Red Robin Gourmet Burgers Inc. Common Stock,$9.97,-0.22,-2.159%,158802609.00,United States,2002,11190,Consumer Discretionary,Restaurants
RRR,Red Rock Resorts Inc. Class A Common Stock,$46.23,-0.10,-0.216%,2681359370.00,United States,2016,26013,Consumer Discretionary,Recreational Games/Products/Toys
RSLS,ReShape Lifesciences Inc. Common Stock,$4.20,-0.14,-3.226%,7535632.00,United States,2016,25437,Health Care,Biotechnology: Electromedical & Electrotherapeutic Apparatus
RSSS,Research Solutions Inc Common Stock,$2.25,0.00,0.00%,65620820.00,United States,,28,Technology,Computer Software: Prepackaged Software
RSVR,Reservoir Media Inc. Common Stock,$7.0124,-0.0476,-0.674%,451494762.00,United States,2021,7613,Consumer Discretionary,Movies/Entertainment
RSVRW,Reservoir Media Inc. Warrant,$1.77,0.01,0.568%,0.00,United States,2021,522,Consumer Discretionary,Movies/Entertainment
RTC,Baijiayun Group Ltd. Class A Ordinary Shares,$9.25,-0.0825,-0.884%,775018706.00,China,2006,932,Industrials,Specialty Chemicals
RTL,The Necessity Retail REIT Inc. Class A Common Stock,$6.6631,0.0131,0.197%,894350020.00,United States,,89044,Real Estate,Real Estate Investment Trusts
RTLPO,The Necessity Retail REIT Inc. 7.375% Series C Cumulative Redeemable Preferred Stock,$22.33,-0.755,-3.271%,0.00,United States,,175,Real Estate,Real Estate Investment Trusts
RTLPP,The Necessity Retail REIT Inc. 7.50% Series A Cumulative Redeemable Perpetual Preferred Stock,$23.00,-0.05,-0.217%,0.00,United States,,419,Real Estate,Real Estate Investment Trusts
RUBY,Rubius Therapeutics Inc. Common Stock,$0.1723,-0.0076,-4.225%,15571015.00,United States,2018,332842,Health Care,Biotechnology: Biological Products (No Diagnostic Substances)
RUM,Rumble Inc. Class A Common Stock,$9.3451,-0.0649,-0.69%,2608497548.00,United States,2021,29444,Technology,Computer Software: Prepackaged Software
RUMBW,Rumble Inc. Warrant,$2.19,0.01,0.459%,0.00,United States,2021,1200,Technology,Computer Software: Prepackaged Software
RUN,Sunrun Inc. Common Stock,$24.16,-0.39,-1.589%,5148585851.00,United States,2015,478603,Industrials,Building Products
RUSHA,Rush Enterprises Inc. Common Stock Cl A,$61.615,0.265,0.432%,3353608700.00,United States,,25056,Consumer Discretionary,Other Specialty Stores
RUSHB,Rush Enterprises Inc. Class B,$65.49,0.59,0.909%,3564518929.00,United States,,2428,Consumer Discretionary,Other Specialty Stores
RUTH,Ruth's Hospitality Group Inc. Common Stock,$17.305,-0.125,-0.717%,574562963.00,United States,2005,30248,Consumer Discretionary,Restaurants
RVLP,RVL Pharmaceuticals plc Ordinary Shares,$1.23,0.00,0.00%,122087324.00,United States,2018,1511,Health Care,Biotechnology: Pharmaceutical Preparations
RVMD,Revolution Medicines Inc. Common Stock,$25.25,-0.23,-0.903%,2241967675.00,United States,2020,65389,Health Care, Medicinal Chemicals and Botanical Products 
RVNC,Revance Therapeutics Inc. Common Stock,$33.05,0.29,0.885%,2719141885.00,United States,2014,70486,Health Care,Biotechnology: Pharmaceutical Preparations
RVPH,Reviva Pharmaceuticals Holdings Inc. Common Stock ,$4.58,-0.01,-0.218%,23516253.00,United States,2020,2661,Health Care,Biotechnology: Pharmaceutical Preparations
RVPHW,Reviva Pharmaceuticals Holdings Inc. Warrants,$0.979,-0.001,-0.102%,0.00,United States,2018,4838,Health Care,Biotechnology: Pharmaceutical Preparations
RVSB,Riverview Bancorp Inc Common Stock,$7.19,0.02,0.279%,154558649.00,United States,,2294,Finance,Major Banks
RVSN,Rail Vision Ltd. Ordinary Share,$2.02,0.02,1.00%,32110001.00,Israel,2022,52829,,
RVSNW,Rail Vision Ltd. Warrant,$0.285,0.035,14.00%,0.00,Israel,2022,9570,,
