Symbol,Name,Last Sale,Net Change,% Change,Market Cap,Country,IPO Year,Volume,Sector,Industry
KAL,Kalera Public Limited Company Ordinary Shares,$5.9337,0.1137,1.954%,5451753.00,Ireland,,44203,Consumer Staples,Farming/Seeds/Milling
KALA,Kala Pharmaceuticals Inc. Common Stock,$12.33,0.05,0.407%,691218135.00,United States,2017,11484,Health Care,Biotechnology: Pharmaceutical Preparations
KALU,Kaiser Aluminum Corporation Common Stock,$88.7399,0.1099,0.124%,1414569468.00,United States,,6363,Industrials,Aluminum
KALV,KalVista Pharmaceuticals Inc. Common Stock,$7.705,0.085,1.115%,262758584.00,United Kingdom,2015,16518,Health Care,Biotechnology: Pharmaceutical Preparations
KALWW,Kalera Public Limited Company Warrant,$0.0418,0.0004,0.966%,0.00,Ireland,,22489,Consumer Staples,Farming/Seeds/Milling
KARO,Karooooo Ltd. Ordinary Shares,$25.40,0.00,0.00%,786158092.00,Singapore,2021,55,Technology,Computer Software: Prepackaged Software
KAVL,Kaival Brands Innovations Group Inc. Common Stock,$0.6734,-0.0097,-1.42%,37824265.00,United States,,3714,Health Care, Medicinal Chemicals and Botanical Products 
KBAL,Kimball International Inc. Class B Common Stock,$7.05,-0.02,-0.283%,256705009.00,United States,,17823,Consumer Discretionary,Industrial Specialties
KBNT,Kubient Inc. Common Stock,$1.0186,-0.0114,-1.107%,14670387.00,United States,2020,1304,Technology,EDP Services
KBNTW,Kubient Inc. Warrant,$0.099,0.004,4.211%,0.00,United States,2020,860,Technology,EDP Services
KC,Kingsoft Cloud Holdings Limited American Depositary Shares,$4.505,-0.205,-4.352%,1142853867.00,China,2020,210615,Technology,Computer Software: Prepackaged Software
KDNY,Chinook Therapeutics Inc. Common Stock,$22.14,0.11,0.499%,1415645327.00,United States,2015,25787,Health Care,Biotechnology: Pharmaceutical Preparations
KDP,Keurig Dr Pepper Inc. Common Stock,$35.69,-0.21,-0.585%,50546009147.00,United States,,680147,Consumer Staples,Beverages (Production/Distribution)
KE,Kimball Electronics Inc. Common Stock,$26.23,-0.06,-0.228%,648515058.00,United States,,9162,Technology,Industrial Machinery/Components
KELYA,Kelly Services Inc. Class A Common Stock,$16.295,0.025,0.154%,618363018.00,United States,,42866,Consumer Discretionary,Diversified Commercial Services
KELYB,Kelly Services Inc. Class B Common Stock,$16.005,0.00,0.00%,607358092.00,United States,,149,Consumer Discretionary,Diversified Commercial Services
KEQU,Kewaunee Scientific Corporation Common Stock,$15.55,-0.10,-0.639%,44009610.00,United States,,1190,Industrials,Medical Specialities
KERN,Akerna Corp. Common Stock,$0.97,0.02,2.105%,13636946.00,United States,2018,30568,Health Care,Managed Health Care
KERNW,Akerna Corp Warrant,$0.02,-0.0047,-19.028%,0.00,United States,2018,6601,Health Care,Managed Health Care
KFFB,Kentucky First Federal Bancorp Common Stock,$7.14,0.00,0.00%,58222880.00,United States,2005,57,Finance,Savings Institutions
KFRC,Kforce Inc. Common Stock,$61.39,0.18,0.294%,1274066328.00,United States,1995,12654,Consumer Discretionary,Diversified Commercial Services
KHC,The Kraft Heinz Company Common Stock,$39.755,-0.025,-0.063%,48697098670.00,United States,,485232,Consumer Staples,Farming/Seeds/Milling
KIDS,OrthoPediatrics Corp. Common Stock,$43.50,-0.53,-1.204%,995780250.00,United States,2017,5996,Health Care,Medical/Dental Instruments
KINS,Kingstone Companies Inc. Common Stock,$1.51,0.00,0.00%,16133593.00,United States,,3,Finance,Specialty Insurers
KINZ,KINS Technology Group Inc. Class A Common Stock,$10.2001,0.00,0.00%,79948384.00,United States,2021,50,Industrials,Consumer Electronics/Appliances
KIRK,Kirkland's Inc. COMMONSTOCK,$3.41,-0.03,-0.872%,43492395.00,United States,2002,4798,Miscellaneous,Diversified Commercial Services
KITT,Nauticus Robotics Inc. Common stock,$3.90,0.14,3.723%,184278007.00,United States,2021,651,Industrials,Metal Fabrications
KLAC,KLA Corporation Common Stock,$387.83,-5.00,-1.273%,53706606872.00,United States,1980,82761,Technology,Electronic Components
KLIC,Kulicke and Soffa Industries Inc. Common Stock,$53.51,-0.57,-1.054%,3033368405.00,Singapore,,76625,Technology,Semiconductors
KLTR,Kaltura Inc. Common Stock,$2.0002,-0.0298,-1.468%,266556379.00,United States,2021,12350,Technology,EDP Services
KLXE,KLX Energy Services Holdings Inc. Common Stock,$12.78,-0.42,-3.182%,156879778.00,United States,,23224,Energy,Oilfield Services/Equipment
KMDA,Kamada Ltd. Ordinary Shares,$4.21,-0.04,-0.941%,188610122.00,Israel,2013,103,Health Care,Biotechnology: Pharmaceutical Preparations
KMPH,KemPharm Inc. Common Stock,$5.37,0.05,0.94%,185291109.00,United States,,18178,Health Care,Biotechnology: Pharmaceutical Preparations
KNDI,Kandi Technologies Group Inc Common Stock,$2.41,-0.05,-2.033%,178900882.00,China,,51124,Consumer Discretionary,Auto Parts:O.E.M.
KNSA,Kiniksa Pharmaceuticals Ltd. Class A Common Stock,$13.785,0.205,1.51%,958495339.00,United States,2018,18874,Health Care,Biotechnology: Pharmaceutical Preparations
KNTE,Kinnate Biopharma Inc. Common Stock,$7.19,0.28,4.052%,317544071.00,United States,2020,15311,Health Care,Biotechnology: Pharmaceutical Preparations
KOD,Kodiak Sciences Inc Common Stock,$7.21,0.04,0.558%,377149000.00,United States,2018,15529,Health Care,Biotechnology: Pharmaceutical Preparations
KOPN,Kopin Corporation Common Stock,$1.2199,-0.0201,-1.621%,133120926.00,United States,1992,14662,Technology,Industrial Machinery/Components
KOSS,Koss Corporation Common Stock,$5.06,0.00,0.00%,46500363.00,United States,,217,Consumer Staples,Consumer Electronics/Appliances
KPLT,Katapult Holdings Inc. Common Stock,$0.9475,-0.0099,-1.034%,93279711.00,United States,2019,997,Technology,EDP Services
KPLTW,Katapult Holdings Inc. Warrant,$0.0987,-0.0112,-10.191%,0.00,United States,2019,612,Technology,EDP Services
KPRX,Kiora Pharmaceuticals Inc.  Common Stock,$5.53,0.03,0.545%,10226463.00,United States,,6903,Health Care,Biotechnology: In Vitro & In Vivo Diagnostic Substances
KPTI,Karyopharm Therapeutics Inc. Common Stock,$3.51,-0.08,-2.228%,397378216.00,United States,2013,182461,Miscellaneous,Diversified Commercial Services
KRBP,Kiromic BioPharma Inc. Common Stock,$0.1503,-0.0067,-4.268%,3081857.00,United States,2020,93888,Health Care, Medicinal Chemicals and Botanical Products 
KRKR,36Kr Holdings Inc. American Depositary Shares,$1.23,0.00,0.00%,49958329.00,China,2019,823,Consumer Discretionary,Business Services
KRMD,KORU Medical Systems Inc. Common Stock,$4.11,0.00,0.00%,186100586.00,United States,,2336,Health Care,Medical/Dental Instruments
KRNL,Kernel Group Holdings Inc. Class A Ordinary Shares,$10.19,0.00,0.00%,388175313.00,United States,2021,259,Finance,Blank Checks
KRNLU,Kernel Group Holdings Inc. Units,$10.18,0.00,0.00%,0.00,United States,2021,100,Finance,Blank Checks
KRNLW,Kernel Group Holdings Inc. Warrants,$0.10,0.00,0.00%,0.00,United States,2021,20,Finance,Blank Checks
KRNT,Kornit Digital Ltd. Ordinary Shares,$21.355,-0.405,-1.861%,1065881267.00,Israel,2015,19637,Industrials,Industrial Machinery/Components
KRNY,Kearny Financial Corp Common Stock,$9.76,0.00,0.00%,657611954.00,United States,2005,36310,Finance,Savings Institutions
KRON,Kronos Bio Inc. Common Stock,$1.98,-0.02,-1.00%,112658781.00,United States,2020,19870,Health Care, Medicinal Chemicals and Botanical Products 
KROS,Keros Therapeutics Inc. Common Stock,$54.16,-0.22,-0.405%,1491742474.00,United States,2020,7871,Health Care, Medicinal Chemicals and Botanical Products 
KRT,Karat Packaging Inc. Common Stock,$15.21,-0.31,-1.997%,302800863.00,United States,2021,1923,Industrials,Office Equipment/Supplies/Services
KRTX,Karuna Therapeutics Inc. Common Stock,$192.445,-1.245,-0.643%,6612944620.00,United States,2019,14396,Health Care,Biotechnology: Pharmaceutical Preparations
KRUS,Kura Sushi USA Inc. Class A Common Stock,$59.9999,-0.2501,-0.415%,587529581.00,United States,2019,1992,Consumer Discretionary,Restaurants
KRYS,Krystal Biotech Inc. Common Stock,$75.00,0.64,0.861%,1931073525.00,United States,2017,12658,Health Care,Biotechnology: Biological Products (No Diagnostic Substances)
KSCP,Knightscope Inc. Class A Common Stock,$1.18,-0.04,-3.279%,48999586.00,United States,2022,171507,Technology,Security Systems Services
KSI,Kadem Sustainable Impact Corporation Class A common stock,$10.10,0.00,0.00%,220937500.00,United States,2021,4211,Industrials,Consumer Electronics/Appliances
KSICU,Kadem Sustainable Impact Corporation Unit,$10.07,-0.09,-0.886%,0.00,United States,2021,1001,Industrials,Consumer Electronics/Appliances
KSICW,Kadem Sustainable Impact Corporation Warrant,$0.0025,-0.0275,-91.667%,0.00,United States,2021,112062,Industrials,Consumer Electronics/Appliances
KSPN,Kaspien Holdings Inc. Common Stock,$0.7101,0.0001,0.014%,3525471.00,United States,,3628,Technology,Retail: Computer Software & Peripheral Equipment
KTCC,Key Tronic Corporation Common Stock,$6.98,0.00,0.00%,75117860.00,United States,1983,45,Technology,Computer peripheral equipment
KTOS,Kratos Defense & Security Solutions Inc. Common Stock,$11.505,-0.075,-0.648%,1449135135.00,United States,,70409,Consumer Discretionary,Ordnance And Accessories
KTRA,Kintara Therapeutics Inc. Common Stock,$6.04,0.00,0.00%,10118842.00,United States,,275,Health Care,Biotechnology: Pharmaceutical Preparations
KTTA,Pasithea Therapeutics Corp. Common Stock,$0.5638,-0.0122,-2.118%,16490410.00,United States,2021,770,Health Care,Biotechnology: Pharmaceutical Preparations
KTTAW,Pasithea Therapeutics Corp. Warrant,$0.0375,0.00,0.00%,0.00,United States,2021,16,Health Care,Biotechnology: Pharmaceutical Preparations
KURA,Kura Oncology Inc. Common Stock,$11.965,-0.025,-0.209%,817209500.00,United States,,32997,Health Care,Biotechnology: Biological Products (No Diagnostic Substances)
KVHI,KVH Industries Inc. Common Stock,$9.94,0.08,0.811%,190668643.00,United States,1996,1149,Technology,Radio And Television Broadcasting And Communications Equipment
KVSA,Khosla Ventures Acquisition Co. Class A Common Stock,$10.10,0.00,0.00%,408949000.00,United States,2021,1772,Industrials,Consumer Electronics/Appliances
KVSC,Khosla Ventures Acquisition Co. III Class A Common Stock,$10.07,0.00,0.00%,631961228.00,United States,2021,3086,Industrials,Consumer Electronics/Appliances
KWE,KWESST Micro Systems Inc. Common Stock,$2.75,0.075,2.804%,11200030.00,Canada,,248,,
KWESW,KWESST Micro Systems Inc. Warrant,$0.40,-0.05,-11.111%,0.00,Canada,,25001,,
KXIN,Kaixin Auto Holdings Ordinary Shares,$0.4085,0.0334,8.904%,80595086.00,China,2017,79428,Consumer Discretionary,Retail-Auto Dealers and Gas Stations
KYCH,Keyarch Acquisition Corporation Ordinary Shares,$10.24,-0.01,-0.098%,154828800.00,United States,2022,4203,Finance,Blank Checks
KYCHU,Keyarch Acquisition Corporation Unit,$10.33,0.00,0.00%,0.00,United States,2022,29,Finance,Blank Checks
KYMR,Kymera Therapeutics Inc. Common Stock,$32.195,-0.095,-0.294%,1766369886.00,United States,2020,18104,Health Care, Medicinal Chemicals and Botanical Products 
KZIA,Kazia Therapeutics Limited American Depositary Shares,$0.897,-0.0018,-0.20%,16936794.00,Australia,,274,Health Care,Biotechnology: Pharmaceutical Preparations
KZR,Kezar Life Sciences Inc. Common Stock,$6.345,0.005,0.079%,434632500.00,United States,2018,35106,Health Care,Biotechnology: Pharmaceutical Preparations
LAB,Standard BioTools Inc. Common Stock,$2.07,-0.03,-1.429%,164143637.00,United States,2011,7604,Industrials,Biotechnology: Laboratory Analytical Instruments
LABP,Landos Biopharma Inc. Common Stock,$0.36,-0.019,-5.013%,14491760.00,United States,2021,1310,Health Care, Medicinal Chemicals and Botanical Products 
LAKE,Lakeland Industries Inc. Common Stock,$15.58,-0.17,-1.079%,114043824.00,United States,1986,885,,
LAMR,Lamar Advertising Company Class A Common Stock,$105.93,-0.91,-0.852%,10771329977.00,United States,1996,6447,Real Estate,Real Estate Investment Trusts
LANC,Lancaster Colony Corporation Common Stock,$195.16,1.00,0.515%,5380756360.00,United States,,7678,Consumer Staples,Packaged Foods
LAND,Gladstone Land Corporation Common Stock,$18.77,0.02,0.107%,651394174.00,United States,2013,18082,Real Estate,Real Estate Investment Trusts
LANDM,Gladstone Land Corporation 5.00% Series D Cumulative Term Preferred Stock,$23.97,-0.1758,-0.728%,577734672.00,United States,,816,Real Estate,Real Estate Investment Trusts
LANDO,Gladstone Land Corporation 6.00% Series B Cumulative Redeemable Preferred Stock,$24.6296,-0.4904,-1.952%,0.00,United States,,12595,Real Estate,Real Estate Investment Trusts
LARK,Landmark Bancorp Inc. Common Stock,$23.15,0.2364,1.032%,120686321.00,United States,,206,Finance,Major Banks
LASE,Laser Photonics Corporation Common Stock,$5.47,0.00,0.00%,43094941.00,United States,2022,15104,Industrials,Industrial Machinery/Components
LASR,nLIGHT Inc. Common Stock,$13.365,-0.295,-2.16%,605529405.00,United States,2018,28832,Technology,Semiconductors
LATG,LatAmGrowth SPAC Class A Ordinary Shares,$10.40,0.00,0.00%,169000000.00,Mexico,2022,1,Finance,Blank Checks
LATGU,LatAmGrowth SPAC Unit,$10.42,0.02,0.192%,0.00,Mexico,2022,333,Finance,Blank Checks
LATGW,LatAmGrowth SPAC Warrants,$0.1203,-0.0166,-12.126%,0.00,Mexico,2022,717,Finance,Blank Checks
LAUR,Laureate Education Inc. Common Stock,$10.75,0.06,0.561%,1684484989.00,United States,2017,104784,Consumer Discretionary,Service to the Health Industry
LAZR,Luminar Technologies Inc.  Class A Common Stock,$6.455,-0.175,-2.64%,2341601928.00,United States,2019,503282,Consumer Discretionary,Auto Parts:O.E.M.
LAZY,Lazydays Holdings Inc. Common Stock,$12.76,0.06,0.472%,134448330.00,United States,,605,Consumer Discretionary,Other Specialty Stores
LBAI,Lakeland Bancorp Inc. Common Stock,$19.55,0.04,0.205%,1268241794.00,United States,,25919,Finance,Major Banks
LBBB,Lakeshore Acquisition II Corp. Ordinary Shares,$10.32,0.00,0.00%,94340280.00,United States,2022,900,Finance,Blank Checks
LBBBW,Lakeshore Acquisition II Corp. Warrants,$0.0424,-0.0001,-0.235%,0.00,United States,2022,1000,Finance,Blank Checks
LBC,Luther Burbank Corporation Common Stock,$12.08,0.05,0.416%,616965126.00,United States,2017,8157,Finance,Commercial Banks
LBPH,Longboard Pharmaceuticals Inc. Common Stock,$5.08,-0.10,-1.931%,112853978.00,United States,2021,238,Health Care,Biotechnology: Pharmaceutical Preparations
LBRDA,Liberty Broadband Corporation Class A Common Stock,$93.68,-0.85,-0.899%,13841107771.00,United States,,15234,Consumer Discretionary,Telecommunications Equipment
LBRDK,Liberty Broadband Corporation Class C Common Stock,$93.37,-0.63,-0.67%,13795305643.00,United States,,32115,Consumer Discretionary,Telecommunications Equipment
LBRDP,Liberty Broadband Corporation Series A Cumulative Redeemable Preferred Stock,$24.00,-0.11,-0.456%,0.00,United States,,6198,Consumer Discretionary,Telecommunications Equipment
LBTYA,Liberty Global plc Class A Ordinary Shares,$20.625,-0.095,-0.458%,9482402573.00,United Kingdom,,48432,Telecommunications,Cable & Other Pay Television Services
LBTYK,Liberty Global plc Class C Ordinary Shares,$21.21,-0.05,-0.235%,9751357991.00,United Kingdom,,98275,Telecommunications,Cable & Other Pay Television Services
LCA,Landcadia Holdings IV Inc. Class A Common Stock,$10.09,0.00,0.00%,630625000.00,United States,2021,54,Industrials,Consumer Electronics/Appliances
LCAA,L Catterton Asia Acquisition Corp Class A Ordinary Shares,$10.2301,-0.0049,-0.048%,366376628.00,Singapore,2021,3674,Finance,Blank Checks
LCAAW,L Catterton Asia Acquisition Corp Warrant,$0.52,-0.02,-3.704%,0.00,Singapore,2021,20647,Finance,Blank Checks
LCFY,Locafy Limited Ordinary Share,$11.04,-0.37,-3.243%,11331898.00,Australia,2022,232,,
LCFYW,Locafy Limited Warrant,$3.52,0.00,0.00%,0.00,Australia,2022,1,,
LCID,Lucid Group Inc. Common Stock,$10.51,-0.12,-1.129%,19215540234.00,United States,,1876364,Consumer Discretionary,Auto Manufacturing
LCNB,LCNB Corporation Common Stock,$18.67,-0.05,-0.267%,210207024.00,United States,,122,Finance,Major Banks
LCUT,Lifetime Brands Inc. Common Stock,$7.765,-0.015,-0.193%,170863141.00,United States,1991,5093,Consumer Discretionary,Home Furnishings
LDHA,LDH Growth Corp I Class A Ordinary Shares,$10.175,0.00,0.00%,292531250.00,United States,2021,600,Finance,Blank Checks
LDHAW,LDH Growth Corp I Warrant,$0.044,-0.056,-56.00%,0.00,United States,2021,1850,Finance,Blank Checks
LE,Lands' End Inc. Common Stock,$8.48,-0.08,-0.935%,279859012.00,United States,,9567,Consumer Discretionary,Clothing/Shoe/Accessory Stores
LECO,Lincoln Electric Holdings Inc. Common Shares,$174.86,0.48,0.275%,10096136624.00,United States,,13110,Industrials,Industrial Machinery/Components
LEDS,SemiLEDS Corporation Common Stock,$2.31,-0.02,-0.858%,11199820.00,Taiwan,2010,270,Technology,Semiconductors
LEE,Lee Enterprises Incorporated Common Stock,$19.00,0.00,0.00%,113568985.00,United States,,351,Consumer Discretionary,Newspapers/Magazines
LEGA,Lead Edge Growth Opportunities Ltd Class A Ordinary Shares,$10.16,0.00,0.00%,438150000.00,United States,2021,2,Finance,Blank Checks
LEGAU,Lead Edge Growth Opportunities Ltd Units,$10.16,0.00,0.00%,0.00,United States,2021,500,Finance,Blank Checks
LEGH,Legacy Housing Corporation Common Stock (TX),$20.70,0.03,0.145%,505204614.00,United States,2018,5175,Consumer Discretionary,Homebuilding
LEGN,Legend Biotech Corporation American Depositary Shares,$48.705,-0.335,-0.683%,8153352984.00,United States,2020,5182,Health Care,Biotechnology: Pharmaceutical Preparations
LESL,Leslie's Inc. Common Stock,$13.44,-0.46,-3.309%,2468396515.00,United States,2020,51931,Miscellaneous,Diversified Commercial Services
LEXX,Lexaria Bioscience Corp. Common Stock,$2.95,-0.01,-0.338%,17555444.00,Canada,,1012,Health Care,Biotechnology: Pharmaceutical Preparations
LFAC,LF Capital Acquisition Corp. II Class A Common Stock,$10.35,0.00,0.00%,334757813.00,United States,2022,201,Industrials,Consumer Electronics/Appliances
LFACW,LF Capital Acquisition Corp. II Warrants,$0.1697,0.00,0.00%,0.00,United States,2022,500,Industrials,Consumer Electronics/Appliances
LFCR,Lifecore Biomedical Inc. Common Stock,$5.94,-0.03,-0.503%,178760795.00,United States,,11201,Health Care,Biotechnology: Pharmaceutical Preparations
LFLY,Leafly Holdings Inc. Common Stock,$0.6001,-0.0309,-4.897%,24025344.00,United States,2019,6476,Consumer Staples,Retail-Drug Stores and Proprietary Stores
LFLYW,Leafly Holdings Inc. Warrant,$0.0899,0.02,28.612%,0.00,United States,2019,18652,Consumer Staples,Retail-Drug Stores and Proprietary Stores
LFMD,LifeMD Inc. Common Stock,$1.84,-0.02,-1.075%,57867512.00,United States,,1298,Miscellaneous,Diversified Commercial Services
LFMDP,LifeMD Inc. 8.875% Series A Cumulative Perpetual Preferred Stock,$14.98,-0.02,-0.133%,0.00,United States,,501,Miscellaneous,Diversified Commercial Services
LFST,LifeStance Health Group Inc. Common Stock,$5.50,-0.12,-2.135%,2067925233.00,United States,2021,44614,Health Care,Hospital/Nursing Management
LFUS,Littelfuse Inc. Common Stock,$269.95,-0.20,-0.074%,6682769091.00,United States,,5152,Technology,Electronic Components
LFVN,Lifevantage Corporation Common Stock (Delaware),$3.98,0.00,0.00%,50614954.00,United States,,408,Consumer Staples,Farming/Seeds/Milling
LGAC,Lazard Growth Acquisition Corp. I Ordinary Shares,$10.19,0.00,0.00%,732406250.00,,2021,1,Finance,Blank Checks
LGACU,Lazard Growth Acquisition Corp. I Units,$10.16,-0.03,-0.294%,0.00,,2021,855,Finance,Blank Checks
LGHL,Lion Group Holding Ltd. American Depositary Share,$0.4721,-0.0085,-1.769%,26158970.00,China,,19472,Finance,Investment Bankers/Brokers/Service
LGHLW,Lion Group Holding Ltd. Warrant,$0.0249,-0.0023,-8.456%,0.00,China,,167144,Finance,Investment Bankers/Brokers/Service
LGIH,LGI Homes Inc. Common Stock,$114.835,-2.085,-1.783%,2674539993.00,United States,2013,14245,Consumer Discretionary,Homebuilding
LGMK,LogicMark Inc. Common Stock,$0.2143,0.0001,0.047%,5114133.00,United States,,22479,Consumer Discretionary,Diversified Commercial Services
LGND,Ligand Pharmaceuticals Incorporated Common Stock,$71.96,0.48,0.672%,1947457150.00,United States,,6271,Health Care,Biotechnology: Pharmaceutical Preparations
LGO,Largo Inc. Common Shares,$6.50,-0.11,-1.664%,416032500.00,Canada,,2805,,
LGST,Semper Paratus Acquisition Corporation Class A Ordinary Shares,$11.00,0.22,2.041%,659083326.00,United States,2022,6772,Finance,Blank Checks
LGSTU,Semper Paratus Acquisition Corporation Unit,$10.19,0.00,0.00%,0.00,United States,2021,25,Finance,Blank Checks
LGSTW,Semper Paratus Acquisition Corporation Warrant,$0.0689,0.0189,37.80%,0.00,United States,2022,61081,Finance,Blank Checks
LGVC,LAMF Global Ventures Corp. I Class A Ordinary Shares,$10.36,0.00,0.00%,360935490.00,United States,2021,43,,
LGVCU,LAMF Global Ventures Corp. I Unit,$10.39,0.00,0.00%,0.00,United States,2021,5,,
LGVCW,LAMF Global Ventures Corp. I Warrant,$0.073,-0.027,-27.00%,0.00,United States,2021,10180,,
LGVN,Longeveron Inc. Class A Common Stock,$3.56,0.00,0.00%,74825522.00,United States,2021,128,Health Care, Medicinal Chemicals and Botanical Products 
LHCG,LHC Group Common Stock,$169.255,0.535,0.317%,5252490754.00,United States,2005,53031,Health Care,Medical/Nursing Services
LHDX,Lucira Health Inc. Common Stock,$0.2694,-0.0013,-0.48%,10937358.00,United States,2021,28964,Health Care,Biotechnology: Electromedical & Electrotherapeutic Apparatus
LI,Li Auto Inc. American Depositary Shares,$24.215,-0.525,-2.122%,23627835915.00,China,2020,540098,Consumer Discretionary,Auto Manufacturing
LIAN,LianBio American Depositary Shares,$2.19,-0.02,-0.905%,237294890.00,United States,2021,5357,Health Care,Biotechnology: Pharmaceutical Preparations
LIBY,Liberty Resources Acquisition Corp. Class A Common Stock,$10.44,0.03,0.288%,155611071.00,United States,2021,166,Industrials,Consumer Electronics/Appliances
LIBYW,Liberty Resources Acquisition Corp. Warrant,$0.06,0.00,0.00%,0.00,United States,2021,100,Industrials,Consumer Electronics/Appliances
LICN,Lichen China Limited Class A Ordinary Shares,$2.56,-0.053,-2.028%,69120000.00,China,2023,43269,,
LIDR,AEye Inc. Class A Common Stock,$0.6801,-0.02,-2.857%,109536044.00,United States,2021,61411,Consumer Discretionary,Auto Parts:O.E.M.
LIDRW,AEye Inc. Warrant,$0.0602,-0.0298,-33.111%,0.00,United States,2021,4810,Consumer Discretionary,Auto Parts:O.E.M.
LIFE,aTyr Pharma Inc. Common Stock,$2.22,0.025,1.139%,113740328.00,United States,2015,10866,Health Care,Biotechnology: Biological Products (No Diagnostic Substances)
LIFW,MSP Recovery Inc. Class A Common Stock,$1.14,0.00,0.00%,3673719222.00,United States,2020,901,Technology,Computer Software: Prepackaged Software
LIFWW,MSP Recovery Inc. Warrant,$0.027,0.00,0.00%,0.00,United States,,10000,Technology,Computer Software: Prepackaged Software
LIFWZ,MSP Recovery Inc. Warrant,$1.20,0.04,3.448%,0.00,United States,2020,4411,Technology,Computer Software: Prepackaged Software
LILA,Liberty Latin America Ltd. Class A Common Stock,$8.99,-0.03,-0.333%,1954583577.00,United States,,25741,Telecommunications,Cable & Other Pay Television Services
LILAK,Liberty Latin America Ltd. Class C Common Stock,$9.015,-0.015,-0.166%,1960019015.00,United States,,76424,Telecommunications,Cable & Other Pay Television Services
LILM,Lilium N.V. Class A Ordinary Shares,$1.09,0.01,0.926%,432620548.00,Germany,,296216,Industrials,Aerospace
LILMW,Lilium N.V. Warrants,$0.1096,0.0179,19.52%,0.00,Germany,,5000,Industrials,Aerospace
LINC,Lincoln Educational Services Corporation Common Stock,$6.68,-0.05,-0.743%,175387274.00,United States,2005,828,Consumer Discretionary,Service to the Health Industry
LIND,Lindblad Expeditions Holdings Inc. Common Stock,$11.21,0.07,0.628%,595712807.00,United States,2013,13200,,
LINK,Interlink Electronics Inc. Common Stock,$8.96,0.00,0.00%,59174510.00,United States,,7,Technology,Industrial Machinery/Components
LION,Lionheart III Corp Class A Common Stock,$7.10,0.12,1.719%,110937500.00,United States,2021,511,Industrials,Consumer Electronics/Appliances
LIONU,Lionheart III Corp Unit,$7.00,0.00,0.00%,0.00,United States,2021,14,Industrials,Consumer Electronics/Appliances
LIONW,Lionheart III Corp Warrant,$0.0916,-0.027,-22.766%,0.00,United States,2021,1000,Industrials,Consumer Electronics/Appliances
LIPO,Lipella Pharmaceuticals Inc. Common Stock,$2.39,-0.05,-2.049%,13728029.00,United States,2022,5499,Health Care,Biotechnology: Pharmaceutical Preparations
LIQT,LiqTech International Inc. Common Stock,$0.485,-0.0044,-0.899%,21289982.00,Denmark,,3071,Industrials,Industrial Machinery/Components
LITE,Lumentum Holdings Inc. Common Stock,$57.92,-0.49,-0.839%,3967520000.00,United States,,22287,Technology,Computer peripheral equipment
LITM,Snow Lake Resources Ltd. Common Shares,$2.20,-0.02,-0.901%,39434468.00,Canada,2021,5512,,
LITT,Logistics Innovation Technologies Corp. Class A Common Stock,$10.06,-0.02,-0.198%,428676861.00,United States,2021,3976,Industrials,Consumer Electronics/Appliances
LITTU,Logistics Innovation Technologies Corp. Units,$10.15,-0.0105,-0.103%,0.00,United States,2021,600,Industrials,Consumer Electronics/Appliances
LITTW,Logistics Innovation Technologies Corp. Warrant,$0.1001,0.00,0.00%,0.00,United States,2021,200,Industrials,Consumer Electronics/Appliances
LIVB,LIV Capital Acquisition Corp. II Class A Ordinary Shares,$10.38,0.02,0.193%,130200668.00,Mexico,2022,431,Finance,Blank Checks
LIVE,Live Ventures Incorporated Common Stock,$34.00,0.00,0.00%,107640260.00,United States,,21,Consumer Discretionary,Home Furnishings
LIVN,LivaNova PLC Ordinary Shares,$54.10,-0.16,-0.295%,2895578232.00,United Kingdom,,31073,Health Care,Biotechnology: Electromedical & Electrotherapeutic Apparatus
LIXT,Lixte Biotechnology Holdings Inc. Common Stock,$1.25,0.08,6.838%,20808241.00,United States,,204065,Health Care,Biotechnology: Pharmaceutical Preparations
LIXTW,Lixte Biotechnology Holdings Inc. Warrants,$0.1344,-0.0156,-10.40%,0.00,United States,,7678,Health Care,Biotechnology: Pharmaceutical Preparations
LIZI,LIZHI INC. American Depositary Shares,$0.9899,-0.0101,-1.01%,50957029.00,China,2020,9899,Technology,Computer Software: Programming Data Processing
