,Symbol,Company Name,Market,Industry Group,Sector,Factsheet (Click to clear sorting)
0,24CS,Twenty-Four Con & Supply Public Company Limited,mai,PROPCON,-,
1,2S,2S METAL PUBLIC COMPANY LIMITED,SET,INDUS,STEEL,
2,3K-BAT,THAI ENERGY STORAGE TECHNOLOGY PUBLIC COMPANY LIMITED,SET,INDUS,AUTO,
3,7UP,SEVEN UTILITIES AND POWER PUBLIC COMPANY LIMITED,SET,RESOURC,ENERG,
4,A,AREEYA PROPERTY PUBLIC COMPANY LIMITED,SET,PROPCON,PROP,
5,A5,ASSET FIVE GROUP PUBLIC COMPANY LIMITED,mai,PROPCON,-,
6,AAI,Asian Alliance International Public Company Limited,SET,AGRO,FOOD,
7,AAV,ASIA AVIATION PUBLIC COMPANY LIMITED,SET,SERVICE,TRANS,
8,ABM,ASIA BIOMASS PUBLIC COMPANY LIMITED,mai,RESOURC,-,
9,ACAP,ASIA CAPITAL GROUP PUBLIC COMPANY LIMITED,mai,FINCIAL,-,
10,ACC,ADVANCED CONNECTION CORPORATION PUBLIC COMPANY LIMITED,SET,RESOURC,ENERG,
11,ACE,ABSOLUTE CLEAN ENERGY PUBLIC COMPANY LIMITED,SET,RESOURC,ENERG,
12,ACG,AUTOCORP HOLDING PUBLIC COMPANY LIMITED,SET,INDUS,AUTO,
13,ADB,APPLIED DB PUBLIC COMPANY LIMITED,mai,INDUS,-,
14,ADD,ADDTECH HUB PUBLIC COMPANY LIMITED,mai,SERVICE,-,
15,ADVANC,ADVANCED INFO SERVICE PUBLIC COMPANY LIMITED,SET,TECH,ICT,
16,AEONTS,AEON THANA SINSAP (THAILAND) PUBLIC COMPANY LIMITED,SET,FINCIAL,FIN,
17,AF,AIRA FACTORING PUBLIC COMPANY LIMITED,mai,FINCIAL,-,
18,AFC,ASIA FIBER PUBLIC COMPANY LIMITED,SET,CONSUMP,FASHION,
19,AGE,ASIA GREEN ENERGY PUBLIC COMPANY LIMITED,SET,RESOURC,ENERG,
20,AH,AAPICO HITECH PUBLIC COMPANY LIMITED,SET,INDUS,AUTO,
21,AHC,AIKCHOL HOSPITAL PUBLIC COMPANY LIMITED,SET,SERVICE,HELTH,
22,AI,ASIAN INSULATORS PUBLIC COMPANY LIMITED,SET,RESOURC,ENERG,
23,AIE,AI ENERGY PUBLIC COMPANY LIMITED,SET,RESOURC,ENERG,
24,AIMCG,AIM COMMERCIAL GROWTH FREEHOLD AND LEASEHOLD REAL ESTATE INVESTMENT TRUST,SET,PROPCON,PF&REIT,
25,AIMIRT,AIM INDUSTRIAL GROWTH FREEHOLD AND LEASEHOLD REAL ESTATE INVESTMENT TRUST,SET,PROPCON,PF&REIT,
26,AIRA,AIRA CAPITAL PUBLIC COMPANY LIMITED,mai,FINCIAL,-,
27,AIT,"ADVANCED INFORMATION TECHNOLOGY PUBLIC CO.,LTD.",SET,TECH,ICT,
28,AJ,A.J. PLAST PUBLIC COMPANY LIMITED,SET,INDUS,PKG,
29,AJA,AJ ADVANCE TECHNOLOGY PUBLIC COMPANY LIMITED,SET,CONSUMP,HOME,
30,AKP,AKKHIE PRAKARN PUBLIC COMPANY LIMITED,mai,SERVICE,-,
31,AKR,EKARAT ENGINEERING PUBLIC COMPANY LIMITED,SET,RESOURC,ENERG,
32,ALL,ALL INSPIRE DEVELOPMENT PUBLIC COMPANY LIMITED,mai,PROPCON,-,
33,ALLA,ALLA PUBLIC COMPANY LIMITED,SET,INDUS,IMM,
34,ALLY,ALLY LEASEHOLD REAL ESTATE INVESTMENT TRUST,SET,PROPCON,PF&REIT,
35,ALPHAX,ALPHA DIVISIONS PUBLIC COMPANY LIMITED,mai,CONSUMP,-,
36,ALT,ALT TELECOM PUBLIC COMPANY LIMITED,SET,TECH,ICT,
37,ALUCON,ALUCON PUBLIC COMPANY LIMITED,SET,INDUS,PKG,
38,AMA,AMA MARINE PUBLIC COMPANY LIMITED,mai,SERVICE,-,
39,AMANAH,AMANAH LEASING PUBLIC COMPANY LIMITED,SET,FINCIAL,FIN,
40,AMARC,ASIA MEDICAL AND AGRICULTURAL LABORATORY AND RESEARCH CENTER PUBLIC COMPANY LIMITED,mai,SERVICE,-,
41,AMARIN,AMARIN PRINTING AND PUBLISHING PUBLIC COMPANY LIMITED,SET,SERVICE,MEDIA,
42,AMATA,AMATA CORPORATION PUBLIC COMPANY LIMITED,SET,PROPCON,PROP,
43,AMATAR,AMATA SUMMIT GROWTH FREEHOLD AND LEASEHOLD REAL ESTATE INVESTMENT TRUST,SET,PROPCON,PF&REIT,
44,AMATAV,AMATA VN PUBLIC COMPANY LIMITED,SET,PROPCON,PROP,
45,AMC,ASIA METAL PUBLIC COMPANY LIMITED,SET,INDUS,STEEL,
46,AMR,AMR ASIA PUBLIC COMPANY LIMITED,SET,TECH,ICT,
47,ANAN,ANANDA DEVELOPMENT PUBLIC COMPANY LIMITED,SET,PROPCON,PROP,
48,AOT,AIRPORTS OF THAILAND PUBLIC COMPANY LIMITED,SET,SERVICE,TRANS,
49,AP,AP (THAILAND) PUBLIC COMPANY LIMITED,SET,PROPCON,PROP,
50,APCO,ASIAN PHYTOCEUTICALS PUBLIC COMPANY LIMITED,SET,CONSUMP,PERSON,
51,APCS,ASIA PRECISION PUBLIC COMPANY LIMITED,SET,PROPCON,CONS,
52,APEX,APEX DEVELOPMENT PUBLIC COMPANY LIMITED,SET,PROPCON,PROP,
53,APP,APPLICAD PUBLIC COMPANY LIMITED,mai,TECH,-,
54,APURE,AGRIPURE HOLDINGS PUBLIC COMPANY LIMITED,SET,AGRO,FOOD,
55,AQ,AQ ESTATE PUBLIC COMPANY LIMITED,SET,PROPCON,PROP,
56,AQUA,AQUA CORPORATION PUBLIC COMPANY LIMITED,SET,SERVICE,MEDIA,
57,ARIN,ARINSIRI LAND PUBLIC COMPANY LIMITED,mai,PROPCON,-,
58,ARIP,ARIP PUBLIC COMPANY LIMITED,mai,SERVICE,-,
59,ARROW,ARROW SYNDICATE PUBLIC COMPANY LIMITED,mai,PROPCON,-,
60,AS,ASIASOFT CORPORATION PUBLIC COMPANY LIMITED,SET,SERVICE,MEDIA,
61,ASAP,SYNERGETIC AUTO PERFORMANCE PUBLIC COMPANY LIMITED,SET,FINCIAL,FIN,
62,ASEFA,ASEFA PUBLIC COMPANY LIMITED,SET,INDUS,IMM,
63,ASIA,ASIA HOTEL PUBLIC COMPANY LIMITED,SET,SERVICE,TOURISM,
64,ASIAN,ASIAN SEA CORPORATION PUBLIC COMPANY LIMITED,SET,AGRO,FOOD,
65,ASIMAR,ASIAN MARINE SERVICES PUBLIC COMPANY LIMITED,SET,SERVICE,TRANS,
66,ASK,ASIA SERMKIJ LEASING PUBLIC COMPANY LIMITED,SET,FINCIAL,FIN,
67,ASN,ASN BROKER PUBLIC COMPANY LIMITED,mai,FINCIAL,-,
68,ASP,ASIA PLUS GROUP HOLDINGS PUBLIC COMPANY LIMITED,SET,FINCIAL,FIN,
69,ASW,ASSETWISE PUBLIC COMPANY LIMITED,SET,PROPCON,PROP,
70,ATP30,ATP30 PUBLIC COMPANY LIMITED,mai,SERVICE,-,
71,AU,AFTER YOU PUBLIC COMPANY LIMITED,mai,AGRO,-,
72,AUCT,UNION AUCTION PUBLIC COMPANY LIMITED,mai,SERVICE,-,
73,AURA,Aurora Design Public Company Limited,SET,CONSUMP,FASHION,
74,AWC,ASSET WORLD CORP PUBLIC COMPANY LIMITED,SET,PROPCON,PROP,
75,AYUD,ALLIANZ AYUDHYA CAPITAL PUBLIC COMPANY LIMITED,SET,FINCIAL,INSUR,
76,B,BEGISTICS PUBLIC COMPANY LIMITED,SET,SERVICE,TRANS,
77,B52,B-52 CAPITAL PUBLIC COMPANY LIMITED,SET,SERVICE,COMM,
78,BA,BANGKOK AIRWAYS PUBLIC COMPANY LIMITED,SET,SERVICE,TRANS,
79,BAFS,BANGKOK AVIATION FUEL SERVICES PCL.,SET,RESOURC,ENERG,
80,BAM,BANGKOK COMMERCIAL ASSET MANAGEMENT PUBLIC COMPANY LIMITED,SET,FINCIAL,FIN,
81,BANPU,BANPU PUBLIC COMPANY LIMITED,SET,RESOURC,ENERG,
82,BAREIT,BA Airport Leasehold Real Estate Investment Trust,SET,PROPCON,PF&REIT,
83,BAY,BANK OF AYUDHYA PUBLIC COMPANY LIMITED,SET,FINCIAL,BANK,
84,BBGI,BBGI PUBLIC COMPANY LIMITED,SET,RESOURC,ENERG,
85,BBIK,BLUEBIK GROUP PUBLIC COMPANY LIMITED,mai,TECH,-,
86,BBL,BANGKOK BANK PUBLIC COMPANY LIMITED,SET,FINCIAL,BANK,
87,BC,BOUTIQUE CORPORATION PUBLIC COMPANY LIMITED,mai,PROPCON,-,
88,BCH,BANGKOK CHAIN HOSPITAL PUBLIC COMPANY LIMITED,SET,SERVICE,HELTH,
89,BCP,BANGCHAK CORPORATION PUBLIC COMPANY LIMITED,SET,RESOURC,ENERG,
90,BCPG,BCPG PUBLIC COMPANY LIMITED,SET,RESOURC,ENERG,
91,BCT,BIRLA CARBON (THAILAND) PUBLIC COMPANY LIMITED,SET,INDUS,PETRO,
92,BDMS,BANGKOK DUSIT MEDICAL SERVICES PUBLIC COMPANY LIMITED,SET,SERVICE,HELTH,
93,BE8,BERYL 8 PLUS PUBLIC COMPANY LIMITED,mai,TECH,-,
94,BEAUTY,BEAUTY COMMUNITY PUBLIC COMPANY LIMITED,SET,SERVICE,COMM,
95,BEC,BEC WORLD PUBLIC COMPANY LIMITED,SET,SERVICE,MEDIA,
96,BEM,BANGKOK EXPRESSWAY AND METRO PUBLIC COMPANY LIMITED,SET,SERVICE,TRANS,
97,BEYOND,BOUND AND BEYOND PUBLIC COMPANY LIMITED,SET,SERVICE,TOURISM,
98,BGC,BG CONTAINER GLASS PUBLIC COMPANY LIMITED,SET,INDUS,PKG,
99,BGRIM,B.GRIMM POWER PUBLIC COMPANY LIMITED,SET,RESOURC,ENERG,
0,BGT,BGT CORPORATION PUBLIC COMPANY LIMITED,mai,CONSUMP,-,
1,BH,BUMRUNGRAD HOSPITAL PUBLIC COMPANY LIMITED,SET,SERVICE,HELTH,
2,BIG,BIG CAMERA CORPORATION PUBLIC COMPANY LIMITED,SET,SERVICE,COMM,
3,BIOTEC,BIO GREEN ENERGY TECH PUBLIC COMPANY LIMITED,SET,SERVICE,TRANS,
4,BIS,Bioscience Animal Health Public Company Limited,mai,SERVICE,-,
5,BIZ,BUSINESS ALIGNMENT PUBLIC COMPANY LIMITED,SET,CONSUMP,PERSON,
6,BJC,BERLI JUCKER PUBLIC COMPANY LIMITED,SET,SERVICE,COMM,
7,BJCHI,BJC HEAVY INDUSTRIES PUBLIC COMPANY LIMITED,SET,PROPCON,CONS,
8,BKD,BANGKOK DEC-CON PUBLIC COMPANY LIMITED,SET,PROPCON,CONS,
9,BKI,BANGKOK INSURANCE PUBLIC COMPANY LIMITED,SET,FINCIAL,INSUR,
10,BKKCP,BANGKOK COMMERCIAL PROPERTY FUND,SET,PROPCON,PF&REIT,
11,BLA,BANGKOK LIFE ASSURANCE PUBLIC COMPANY LIMITED,SET,FINCIAL,INSUR,
12,BLAND,BANGKOK LAND PUBLIC COMPANY LIMITED,SET,PROPCON,PROP,
13,BLESS,BLESS ASSET GROUP PUBLIC COMPANY LIMITED,mai,PROPCON,-,
14,BLISS,BLISS INTELLIGENCE PUBLIC COMPANY LIMITED,SET,TECH,ICT,
15,BM,BANGKOK SHEET METAL PUBLIC COMPANY LIMITED,mai,INDUS,-,
16,BOFFICE,BHIRAJ OFFICE LEASEHOLD REAL ESTATE INVESTMENT TRUST,SET,PROPCON,PF&REIT,
17,BOL,BUSINESS ONLINE PUBLIC COMPANY LIMITED,mai,SERVICE,-,
18,BPP,BANPU POWER PUBLIC COMPANY LIMITED,SET,RESOURC,ENERG,
19,BR,BANGKOK RANCH PUBLIC COMPANY LIMITED,SET,AGRO,FOOD,
20,BRI,BRITANIA PUBLIC COMPANY LIMITED,SET,PROPCON,PROP,
21,BROCK,BAAN ROCK GARDEN PUBLIC COMPANY LIMITED,SET,PROPCON,PROP,
22,BROOK,THE BROOKER GROUP PUBLIC COMPANY LIMITED,mai,FINCIAL,-,
23,BRR,BURIRAM SUGAR PUBLIC COMPANY LIMITED,SET,AGRO,FOOD,
24,BRRGIF,BURIRAM SUGAR GROUP POWER PLANT INFRASTRUCTURE FUND,SET,RESOURC,ENERG,
25,BSBM,BANGSAPHAN BARMILL PUBLIC COMPANY LIMITED,SET,INDUS,STEEL,
26,BSM,BUILDERSMART PUBLIC COMPANY LIMITED,mai,PROPCON,-,
27,BTG,BETAGRO PUBLIC COMPANY LIMITED,SET,AGRO,FOOD,
28,BTNC,BOUTIQUE NEWCITY PUBLIC COMPANY LIMITED,SET,CONSUMP,FASHION,
29,BTS,BTS GROUP HOLDINGS PUBLIC COMPANY LIMITED,SET,SERVICE,TRANS,
30,BTSGIF,BTS RAIL MASS TRANSIT GROWTH INFRASTRUCTURE FUND,SET,SERVICE,TRANS,
31,BTW,BT WEALTH INDUSTRIES PUBLIC COMPANY LIMITED,mai,PROPCON,-,
32,BUI,BANGKOK UNION INSURANCE PUBLIC COMPANY LIMITED,SET,FINCIAL,INSUR,
33,BVG,BlueVenture Group Public Company Limited,mai,TECH,-,
34,BWG,BETTER WORLD GREEN PUBLIC COMPANY LIMITED,SET,SERVICE,PROF,
35,B-WORK,BUALUANG OFFICE LEASEHOLD REAL ESTATE INVESTMENT TRUST,SET,PROPCON,PF&REIT,
36,BYD,BEYOND SECURITIES PUBLIC COMPANY LIMITED,SET,FINCIAL,FIN,
37,CAZ,CAZ (THAILAND) PUBLIC COMPANY LIMITED,mai,PROPCON,-,
38,CBG,CARABAO GROUP PUBLIC COMPANY LIMITED,SET,AGRO,FOOD,
39,CCET,"CAL-COMP ELECTRONICS (THAILAND) PUBLIC CO., LTD.",SET,TECH,ETRON,
40,CCP,CHONBURI CONCRETE PRODUCT PUBLIC COMPANY LIMITED,SET,PROPCON,CONMAT,
41,CEN,CAPITAL ENGINEERING NETWORK PUBLIC COMPANY LIMITED,SET,INDUS,STEEL,
42,CENTEL,CENTRAL PLAZA HOTEL PUBLIC COMPANY LIMITED,SET,SERVICE,TOURISM,
43,CEYE,Chamni's Eye Public Company Limited,mai,SERVICE,-,
44,CFRESH,SEAFRESH INDUSTRY PUBLIC COMPANY LIMITED,SET,AGRO,FOOD,
45,CGD,COUNTRY GROUP DEVELOPMENT PUBLIC COMPANY LIMITED,SET,PROPCON,PROP,
46,CGH,COUNTRY GROUP HOLDINGS PUBLIC COMPANY LIMITED,SET,FINCIAL,FIN,
47,CH,Chin Huay Public Company Limited,SET,AGRO,FOOD,
48,CHARAN,CHARAN INSURANCE PUBLIC COMPANY LIMITED,SET,FINCIAL,INSUR,
49,CHASE,Chase Asia Public Company Limited,SET,FINCIAL,FIN,
50,CHAYO,CHAYO GROUP PUBLIC COMPANY LIMITED,SET,FINCIAL,FIN,
51,CHEWA,CHEWATHAI PUBLIC COMPANY LIMITED,mai,PROPCON,-,
52,CHG,CHULARAT HOSPITAL PUBLIC COMPANY LIMITED,SET,SERVICE,HELTH,
53,CHIC,CHIC REPUBLIC PUBLIC COMPANY LIMITED,mai,SERVICE,-,
54,CHO,CHO THAVEE PUBLIC COMPANY LIMITED,mai,INDUS,-,
55,CHOTI,"KIANG HUAT SEA GULL TRADING FROZEN FOOD PUBLIC CO., LTD.",SET,AGRO,FOOD,
56,CHOW,CHOW STEEL INDUSTRIES PUBLIC COMPANY LIMITED,mai,INDUS,-,
57,CI,CHARN ISSARA DEVELOPMENT PUBLIC COMPANY LIMITED,SET,PROPCON,PROP,
58,CIG,C.I.GROUP PUBLIC COMPANY LIMITED,mai,INDUS,-,
59,CIMBT,CIMB THAI BANK PUBLIC COMPANY LIMITED,SET,FINCIAL,BANK,
60,CITY,CITY STEEL PUBLIC COMPANY LIMITED,SET,INDUS,STEEL,
61,CIVIL,CIVIL ENGINEERING PUBLIC COMPANY LIMITED,SET,PROPCON,CONS,
62,CK,CH. KARNCHANG PUBLIC COMPANY LIMITED,SET,PROPCON,CONS,
63,CKP,CK POWER PUBLIC COMPANY LIMITED,SET,RESOURC,ENERG,
64,CM,CHIANGMAI FROZEN FOODS PUBLIC COMPANY LIMITED,SET,AGRO,FOOD,
65,CMAN,CHEMEMAN PUBLIC COMPANY LIMITED,SET,INDUS,PETRO,
66,CMC,CHAOPRAYAMAHANAKORN PUBLIC COMPANY LIMITED,SET,PROPCON,PROP,
67,CMO,CMO PUBLIC COMPANY LIMITED,mai,SERVICE,-,
68,CMR,CHIANG MAI RAM MEDICAL BUSINESS PUBLIC COMPANY LIMITED,SET,SERVICE,HELTH,
69,CNT,CHRISTIANI & NIELSEN (THAI) PUBLIC COMPANY LIMITED,SET,PROPCON,CONS,
70,COLOR,SALEE COLOUR PUBLIC COMPANY LIMITED,mai,INDUS,-,
71,COM7,COM7 PUBLIC COMPANY LIMITED,SET,SERVICE,COMM,
72,COMAN,COMANCHE INTERNATIONAL PUBLIC COMPANY LIMITED,mai,TECH,-,
73,COTTO,SCG CERAMICS PUBLIC COMPANY LIMITED,SET,PROPCON,CONMAT,
74,CPALL,CP ALL PUBLIC COMPANY LIMITED,SET,SERVICE,COMM,
75,CPANEL,CPANEL PUBLIC COMPANY LIMITED,mai,PROPCON,-,
76,CPF,CHAROEN POKPHAND FOODS PUBLIC COMPANY LIMITED,SET,AGRO,FOOD,
77,CPH,CASTLE PEAK HOLDINGS PUBLIC COMPANY LIMITED,SET,CONSUMP,FASHION,
78,CPI,CHUMPORN PALM OIL INDUSTRY PUBLIC COMPANY LIMITED,SET,AGRO,FOOD,
79,CPL,CPL GROUP PUBLIC COMPANY LIMITED,SET,CONSUMP,FASHION,
80,CPN,CENTRAL PATTANA PUBLIC COMPANY LIMITED,SET,PROPCON,PROP,
81,CPNCG,CPN COMMERCIAL GROWTH LEASEHOLD PROPERTY FUND,SET,PROPCON,PF&REIT,
82,CPNREIT,CPN RETAIL GROWTH LEASEHOLD REIT,SET,PROPCON,PF&REIT,
83,CPR,CPR GOMU INDUSTRIAL PUBLIC COMPANY LIMITED,mai,INDUS,-,
84,CPT,CPT DRIVES AND POWER PUBLIC COMPANY LIMITED,SET,INDUS,IMM,
85,CPTGF,C.P. TOWER GROWTH LEASEHOLD PROPERTY FUND,SET,PROPCON,PF&REIT,
86,CPW,COPPERWIRED PUBLIC COMPANY LIMITED,SET,SERVICE,COMM,
87,CRANE,CHU KAI PUBLIC COMPANY LIMITED,SET,INDUS,IMM,
88,CRC,CENTRAL RETAIL CORPORATION PUBLIC COMPANY LIMITED,SET,SERVICE,COMM,
89,CRD,CHIANGMAI RIMDOI PUBLIC COMPANY LIMITED,mai,PROPCON,-,
90,CSC,CROWN SEAL PUBLIC COMPANY LIMITED,SET,INDUS,PKG,
91,CSP,CSP STEEL CENTER PUBLIC COMPANY LIMITED,SET,INDUS,STEEL,
92,CSR,CITY SPORTS AND RECREATION PUBLIC COMPANY LIMITED,SET,SERVICE,TOURISM,
93,CSS,COMMUNICATION AND SYSTEM SOLUTION PUBLIC COMPANY LIMITED,SET,SERVICE,COMM,
94,CTARAF,CENTARA HOTELS & RESORTS LEASEHOLD PROPERTY FUND,SET,PROPCON,PF&REIT,
95,CTW,CHAROONG THAI WIRE & CABLE PUBLIC COMPANY LIMITED,SET,INDUS,IMM,
96,CV,CLOVER POWER PUBLIC COMPANY LIMITED,SET,RESOURC,ENERG,
97,CWT,CHAI WATANA TANNERY GROUP PUBLIC COMPANY LIMITED,SET,INDUS,AUTO,
98,D,DENTAL CORPORATION PUBLIC COMPANY LIMITED,mai,SERVICE,-,
99,DCC,DYNASTY CERAMIC PUBLIC COMPANY LIMITED,SET,PROPCON,CONMAT,
0,DCON,DCON PRODUCTS PUBLIC COMPANY LIMITED,SET,PROPCON,CONMAT,
1,DDD,DO DAY DREAM PUBLIC COMPANY LIMITED,SET,CONSUMP,PERSON,
2,DELTA,DELTA ELECTRONICS (THAILAND) PUBLIC COMPANY LIMITED,SET,TECH,ETRON,
3,DEMCO,DEMCO PUBLIC COMPANY LIMITED,SET,RESOURC,ENERG,
4,DHOUSE,DHOUSE PATTANA PUBLIC COMPANY LIMITED,mai,PROPCON,-,
5,DIF,DIGITAL TELECOMMUNICATIONS INFRASTRUCTURE FUND,SET,TECH,ICT,
6,DIMET,DIMET (SIAM) PUBLIC COMPANY LIMITED,mai,PROPCON,-,
7,DITTO,DITTO (THAILAND) PUBLIC COMPANY LIMITED,mai,TECH,-,
8,DMT,DON MUANG TOLLWAY PUBLIC COMPANY LIMITED,SET,SERVICE,TRANS,
9,DOD,DOD BIOTECH PUBLIC COMPANY LIMITED,mai,CONSUMP,-,
10,DOHOME,DOHOME PUBLIC COMPANY LIMITED,SET,SERVICE,COMM,
11,DPAINT,DELTA PAINT PUBLIC COMPANY LIMITED,mai,PROPCON,-,
12,DREIT,DUSIT THANI FREEHOLD AND LEASEHOLD REAL ESTATE INVESTMENT TRUST,SET,PROPCON,PF&REIT,
13,DRT,DIAMOND BUILDING PRODUCTS PUBLIC COMPANY LIMITED,SET,PROPCON,CONMAT,
14,DTCENT,D.T.C. Enterprise Public Company Limited,SET,TECH,ICT,
15,DTCI,D.T.C. INDUSTRIES PUBLIC COMPANY LIMITED,SET,CONSUMP,HOME,
16,DUSIT,DUSIT THANI PUBLIC COMPANY LIMITED,SET,SERVICE,TOURISM,
17,DV8,DV8 PUBLIC COMPANY LIMITED,mai,SERVICE,-,
18,EA,ENERGY ABSOLUTE PUBLIC COMPANY LIMITED,SET,RESOURC,ENERG,
19,EASON,EASON & CO PUBLIC COMPANY LIMITED,SET,INDUS,AUTO,
20,EASTW,EASTERN WATER RESOURCES DEVELOPMENT AND MANAGEMENT PCL.,SET,RESOURC,ENERG,
21,ECF,EAST COAST FURNITECH PUBLIC COMPANY LIMITED,mai,CONSUMP,-,
22,ECL,EASTERN COMMERCIAL LEASING PUBLIC COMPANY LIMITED,SET,FINCIAL,FIN,
23,EE,ETERNAL ENERGY PUBLIC COMPANY LIMITED,SET,AGRO,AGRI,
24,EFORL,E FOR L AIM PUBLIC COMPANY LIMITED,mai,CONSUMP,-,
25,EGATIF,"NORTH BANGKOK POWER PLANT BLOCK 1 INFRASTRUCTURE FUND, ELECTRICITY GENERATING AUTHORITY OF THAILAND",SET,RESOURC,ENERG,
26,EGCO,ELECTRICITY GENERATING PUBLIC COMPANY LIMITED,SET,RESOURC,ENERG,
27,EKH,EKACHAI MEDICAL CARE PUBLIC COMPANY LIMITED,SET,SERVICE,HELTH,
28,EMC,EMC PUBLIC COMPANY LIMITED,SET,PROPCON,CONS,
29,EP,EASTERN POWER GROUP PUBLIC COMPANY LIMITED,SET,RESOURC,ENERG,
30,EPG,EASTERN POLYMER GROUP PUBLIC COMPANY LIMITED,SET,PROPCON,CONMAT,
31,ERW,THE ERAWAN GROUP PUBLIC COMPANY LIMITED,SET,SERVICE,TOURISM,
32,ERWPF,ERAWAN HOTEL GROWTH PROPERTY FUND,SET,PROPCON,PF&REIT,
33,ESSO,ESSO (THAILAND) PUBLIC COMPANY LIMITED,SET,RESOURC,ENERG,
34,ESTAR,EASTERN STAR REAL ESTATE PUBLIC COMPANY LIMITED,SET,PROPCON,PROP,
35,ETC,EARTH TECH ENVIRONMENT PUBLIC COMPANY LIMITED,SET,RESOURC,ENERG,
36,ETE,EASTERN TECHNICAL ENGINEERING PUBLIC COMPANY LIMITED,mai,SERVICE,-,
37,EVER,EVERLAND PUBLIC COMPANY LIMITED,SET,PROPCON,PROP,
38,F&D,FOOD AND DRINKS PUBLIC COMPANY LIMITED,SET,AGRO,FOOD,
39,FANCY,FANCY WOOD INDUSTRIES PUBLIC COMPANY LIMITED,SET,CONSUMP,HOME,
40,FE,FAR EAST FAME LINE DDB PUBLIC COMPANY LIMITED,SET,SERVICE,MEDIA,
41,FLOYD,FLOYD PUBLIC COMPANY LIMITED,mai,PROPCON,-,
42,FMT,FINE METAL TECHNOLOGIES PUBLIC COMPANY LIMITED,SET,INDUS,IMM,
43,FN,FN FACTORY OUTLET PUBLIC COMPANY LIMITED,SET,SERVICE,COMM,
44,FNS,FNS HOLDINGS PUBLIC COMPANY LIMITED,SET,FINCIAL,FIN,
45,FORTH,FORTH CORPORATION PUBLIC COMPANY LIMITED,SET,TECH,ICT,
46,FPI,FORTUNE PARTS INDUSTRY PUBLIC COMPANY LIMITED,mai,INDUS,-,
47,FPT,FRASERS PROPERTY (THAILAND) PUBLIC COMPANY LIMITED,SET,PROPCON,PROP,
48,FSMART,FORTH SMART SERVICE PUBLIC COMPANY LIMITED,mai,SERVICE,-,
49,FSS,FINANSIA SYRUS SECURITIES PUBLIC COMPANY LIMITED,SET,FINCIAL,FIN,
50,FTE,FIRETRADE ENGINEERING PUBLIC COMPANY LIMITED,SET,SERVICE,COMM,
51,FTI,Function International Public Company Limited,SET,CONSUMP,HOME,
52,FTREIT,FRASERS PROPERTY THAILAND INDUSTRIAL FREEHOLD & LEASEHOLD REIT,SET,PROPCON,PF&REIT,
53,FUTUREPF,FUTURE PARK LEASEHOLD PROPERTY FUND,SET,PROPCON,PF&REIT,
54,FVC,FILTER VISION PUBLIC COMPANY LIMITED,mai,SERVICE,-,
55,GAHREIT,GRANDE HOSPITALITY REAL ESTATE INVESTMENT TRUST,SET,PROPCON,PF&REIT,
56,GBX,GLOBLEX HOLDING MANAGEMENT PUBLIC COMPANY LIMITED,SET,FINCIAL,FIN,
57,GC,GLOBAL CONNECTIONS PUBLIC COMPANY LIMITED,SET,INDUS,PETRO,
58,GCAP,G CAPITAL PUBLIC COMPANY LIMITED,mai,FINCIAL,-,
59,GEL,GENERAL ENGINEERING PUBLIC COMPANY LIMITED,SET,PROPCON,CONMAT,
60,GENCO,"GENERAL ENVIRONMENTAL CONSERVATION PUBLIC CO., LTD.",SET,SERVICE,PROF,
61,GFPT,GFPT PUBLIC COMPANY LIMITED,SET,AGRO,AGRI,
62,GGC,GLOBAL GREEN CHEMICALS PUBLIC COMPANY LIMITED,SET,INDUS,PETRO,
63,GIFT,GRATITUDE INFINITE PUBLIC COMPANY LIMITED,SET,INDUS,PETRO,
64,GJS,G J STEEL PUBLIC COMPANY LIMITED,SET,INDUS,STEEL,
65,GL,GROUP LEASE PUBLIC COMPANY LIMITED,SET,FINCIAL,FIN,
66,GLAND,GRAND CANAL LAND PUBLIC COMPANY LIMITED,SET,PROPCON,PROP,
67,GLOBAL,SIAM GLOBAL HOUSE PUBLIC COMPANY LIMITED,SET,SERVICE,COMM,
68,GLOCON,GLOBAL CONSUMER PUBLIC COMPANY LIMITED,SET,AGRO,FOOD,
69,GLORY,GLORY FOREVER PUBLIC COMPANY LIMITED,mai,SERVICE,-,
70,GPI,GRAND PRIX INTERNATIONAL PUBLIC COMPANY LIMITED,SET,SERVICE,MEDIA,
71,GPSC,GLOBAL POWER SYNERGY PUBLIC COMPANY LIMITED,SET,RESOURC,ENERG,
72,GRAMMY,GMM GRAMMY PUBLIC COMPANY LIMITED,SET,SERVICE,MEDIA,
73,GRAND,GRANDE ASSET HOTELS AND PROPERTY PUBLIC COMPANY LIMITED,SET,SERVICE,TOURISM,
74,GREEN,GREEN RESOURCES PUBLIC COMPANY LIMITED,SET,RESOURC,ENERG,
75,GROREIT,GRANDE ROYAL ORCHID HOSPITALITY REAL ESTATE INVESTMENT TRUST WITH BUY-BACK CONDITION,SET,PROPCON,PF&REIT,
76,GSC,GLOBAL SERVICE CENTER PUBLIC COMPANY LIMITED,mai,SERVICE,-,
77,GSTEEL,G STEEL PUBLIC COMPANY LIMITED,SET,INDUS,STEEL,
78,GTB,GETABEC PUBLIC COMPANY LIMITED,mai,INDUS,-,
79,GTV,GREEN TECH VENTURES PUBLIC COMPANY LIMITED,mai,RESOURC,-,
80,GULF,GULF ENERGY DEVELOPMENT PUBLIC COMPANY LIMITED,SET,RESOURC,ENERG,
81,GUNKUL,GUNKUL ENGINEERING PUBLIC COMPANY LIMITED,SET,RESOURC,ENERG,
82,GVREIT,GOLDEN VENTURES LEASEHOLD REAL ESTATE INVESTMENT TRUST,SET,PROPCON,PF&REIT,
83,GYT,GOODYEAR (THAILAND) PUBLIC COMPANY LIMITED,SET,INDUS,AUTO,
84,HANA,HANA MICROELECTRONICS PUBLIC COMPANY LIMITED,SET,TECH,ETRON,
85,HARN,HARN ENGINEERING SOLUTIONS PUBLIC COMPANY LIMITED,mai,SERVICE,-,
86,HEMP,HEALTH EMPIRE CORPORATION PUBLIC COMPANY LIMITED,mai,SERVICE,-,
87,HENG,HENG LEASING AND CAPITAL PUBLIC COMPANY LIMITED,SET,FINCIAL,FIN,
88,HFT,HWA FONG RUBBER (THAILAND) PUBLIC COMPANY LIMITED,SET,INDUS,AUTO,
89,HL,HEALTHLEAD PUBLIC COMPANY LIMITED,mai,SERVICE,-,
90,HMPRO,HOME PRODUCT CENTER PUBLIC COMPANY LIMITED,SET,SERVICE,COMM,
91,HPF,HEMARAJ INDUSTRIAL PROPERTY AND LEASEHOLD FUND,SET,PROPCON,PF&REIT,
92,HPT,HOME POTTERY PUBLIC COMPANY LIMITED,mai,CONSUMP,-,
93,HTC,HAAD THIP PUBLIC COMPANY LIMITED,SET,AGRO,FOOD,
94,HTECH,HALCYON TECHNOLOGY PUBLIC COMPANY LIMITED,SET,INDUS,IMM,
95,HUMAN,HUMANICA PUBLIC COMPANY LIMITED,SET,TECH,ICT,
96,HYDRO,HYDROTEK PUBLIC COMPANY LIMITED,mai,PROPCON,-,
97,HYDROGEN,Hydrogen Freehold and Leasehold Real Estate Investment Trust,SET,PROPCON,PF&REIT,
98,ICC,I.C.C. INTERNATIONAL PUBLIC COMPANY LIMITED,SET,SERVICE,COMM,
99,ICHI,ICHITAN GROUP PUBLIC COMPANY LIMITED,SET,AGRO,FOOD,
0,ICN,INFORMATION AND COMMUNICATION NETWORKS PUBLIC COMPANY LIMITED,mai,TECH,-,
1,IFEC,INTER FAR EAST ENERGY CORPORATION PUBLIC COMPANY LIMITED,SET,RESOURC,ENERG,
2,IFS,IFS CAPITAL (THAILAND) PUBLIC COMPANY LIMITED,SET,FINCIAL,FIN,
3,IHL,INTERHIDES PUBLIC COMPANY LIMITED,SET,INDUS,AUTO,
4,IIG,I&I GROUP PUBLIC COMPANY LIMITED,mai,TECH,-,
5,III,TRIPLE I LOGISTICS PUBLIC COMPANY LIMITED,SET,SERVICE,TRANS,
6,ILINK,INTERLINK COMMUNICATION PUBLIC COMPANY LIMITED,SET,TECH,ICT,
7,ILM,INDEX LIVING MALL PUBLIC COMPANY LIMITED,SET,SERVICE,COMM,
8,IMH,INTERMEDICAL CARE AND LAB HOSPITAL PUBLIC COMPANY LIMITED,mai,SERVICE,-,
9,IMPACT,IMPACT GROWTH REAL ESTATE INVESTMENT TRUST,SET,PROPCON,PF&REIT,
10,IND,INDEX INTERNATIONAL GROUP PUBLIC COMPANY LIMITED,mai,PROPCON,-,
11,INET,INTERNET THAILAND PUBLIC COMPANY LIMITED,SET,TECH,ICT,
12,INETREIT,INET LEASEHOLD REAL ESTATE INVESTMENT TRUST,SET,PROPCON,PF&REIT,
13,INGRS,INGRESS INDUSTRIAL (THAILAND) PUBLIC COMPANY LIMITED,SET,INDUS,AUTO,
14,INOX,POSCO-THAINOX PUBLIC COMPANY LIMITED,SET,INDUS,STEEL,
15,INSET,INFRASET PUBLIC COMPANY LIMITED,SET,TECH,ICT,
16,INSURE,INDARA INSURANCE PUBLIC COMPANY LIMITED,SET,FINCIAL,INSUR,
17,INTUCH,INTOUCH HOLDINGS PUBLIC COMPANY LIMITED,SET,TECH,ICT,
18,IP,INTER PHARMA PUBLIC COMPANY LIMITED,mai,CONSUMP,-,
19,IRC,INOUE RUBBER (THAILAND) PUBLIC COMPANY LIMITED,SET,INDUS,AUTO,
20,IRCP,"INTERNATIONAL RESEARCH CORPORATION PUBLIC CO., LTD.",mai,TECH,-,
21,IRPC,IRPC PUBLIC COMPANY LIMITED,SET,RESOURC,ENERG,
22,IT,IT CITY PUBLIC COMPANY LIMITED,SET,SERVICE,COMM,
23,ITC,i-Tail Corporation Public Company Limited,SET,AGRO,FOOD,
24,ITD,ITALIAN-THAI DEVELOPMENT PUBLIC COMPANY LIMITED,SET,PROPCON,CONS,
25,ITEL,INTERLINK TELECOM PUBLIC COMPANY LIMITED,SET,TECH,ICT,
26,ITNS,INTERNATIONAL NETWORK SYSTEM PUBLIC COMPANY LIMITED,mai,TECH,-,
27,IVL,INDORAMA VENTURES PUBLIC COMPANY LIMITED,SET,INDUS,PETRO,
28,J,JAS ASSET PUBLIC COMPANY LIMITED,SET,PROPCON,PROP,
29,JAK,JAKPAISAN ESTATE PUBLIC COMPANY LIMITED,mai,PROPCON,-,
30,JAS,JASMINE INTERNATIONAL PUBLIC COMPANY LIMITED,SET,TECH,ICT,
31,JASIF,JASMINE BROADBAND INTERNET INFRASTRUCTURE FUND,SET,TECH,ICT,
32,JCK,JCK INTERNATIONAL PUBLIC COMPANY LIMITED,SET,PROPCON,PROP,
33,JCKH,JCK HOSPITALITY PUBLIC COMPANY LIMITED,mai,AGRO,-,
34,JCT,JACK CHIA INDUSTRIES (THAILAND) PUBLIC COMPANY LIMITED,SET,CONSUMP,PERSON,
35,JDF,JD Food Public Company Limited,SET,AGRO,FOOD,
36,JKN,JKN GLOBAL GROUP PUBLIC COMPANY LIMITED,SET,SERVICE,MEDIA,
37,JMART,JAY MART PUBLIC COMPANY LIMITED,SET,TECH,ICT,
38,JMT,JMT NETWORK SERVICES PUBLIC COMPANY LIMITED,SET,FINCIAL,FIN,
39,JR,J.R.W. UTILITY PUBLIC COMPANY LIMITED,SET,RESOURC,ENERG,
40,JSP,JSP PHARMACEUTICAL MANUFACTURING (THAILAND) PUBLIC COMPANY LIMITED,mai,CONSUMP,-,
41,JTS,JASMINE TECHNOLOGY SOLUTION PUBLIC COMPANY LIMITED,SET,TECH,ICT,
42,JUBILE,JUBILEE ENTERPRISE PUBLIC COMPANY LIMITED,mai,CONSUMP,-,
43,K,KINGSMEN C.M.T.I. PUBLIC COMPANY LIMITED,mai,PROPCON,-,
44,KAMART,KARMARTS PUBLIC COMPANY LIMITED,SET,SERVICE,COMM,
45,KASET,THAI HA PUBLIC COMPANY LIMITED,mai,AGRO,-,
46,KBANK,KASIKORNBANK PUBLIC COMPANY LIMITED,SET,FINCIAL,BANK,
47,KBS,KHONBURI SUGAR PUBLIC COMPANY LIMITED,SET,AGRO,FOOD,
48,KBSPIF,KHONBURI SUGAR POWER PLANT INFRASTRUCTURE FUND,SET,RESOURC,ENERG,
49,KC,K.C. PROPERTY PUBLIC COMPANY LIMITED,SET,PROPCON,PROP,
50,KCAR,KRUNGTHAI CAR RENT AND LEASE PUBLIC COMPANY LIMITED,SET,FINCIAL,FIN,
51,KCC,Knight Club Capital Asset Management Public Company Limited,mai,FINCIAL,-,
52,KCE,KCE ELECTRONICS PUBLIC COMPANY LIMITED,SET,TECH,ETRON,
53,KCM,K.C. METALSHEET PUBLIC COMPANY LIMITED,mai,INDUS,-,
54,KDH,THONBURI MEDICAL CENTRE PUBLIC COMPANY LIMITED,SET,SERVICE,HELTH,
55,KEX,KERRY EXPRESS (THAILAND) PUBLIC COMPANY LIMITED,SET,SERVICE,TRANS,
56,KGEN,KING GEN PUBLIC COMPANY LIMITED,mai,SERVICE,-,
57,KGI,KGI SECURITIES (THAILAND) PUBLIC COMPANY LIMITED,SET,FINCIAL,FIN,
58,KIAT,KIATTANA TRANSPORT PUBLIC COMPANY LIMITED,SET,SERVICE,TRANS,
59,KISS,ROJUKISS INTERNATIONAL PUBLIC COMPANY LIMITED,SET,CONSUMP,PERSON,
60,KJL,KIJCHAROEN ENGINEERING ELECTRIC PUBLIC COMPANY LIMITED,mai,INDUS,-,
61,KK,K&K SUPERSTORE SOUTHERN PUBLIC COMPANY LIMITED,mai,SERVICE,-,
62,KKC,KULTHORN KIRBY PUBLIC COMPANY LIMITED,SET,INDUS,IMM,
63,KKP,KIATNAKIN PHATRA BANK PUBLIC COMPANY LIMITED,SET,FINCIAL,BANK,
64,KLINIQ,The Klinique Medical Clinic Public Company Limited,mai,SERVICE,-,
65,KOOL,MASTERKOOL INTERNATIONAL PUBLIC COMPANY LIMITED,mai,SERVICE,-,
66,KPNPF,KPN PROPERTY FUND,SET,PROPCON,PF&REIT,
67,KSL,KHON KAEN SUGAR INDUSTRY PUBLIC COMPANY LIMITED,SET,AGRO,FOOD,
68,KTB,KRUNG THAI BANK PUBLIC COMPANY LIMITED,SET,FINCIAL,BANK,
69,KTBSTMR,KTBST MIXED FREEHOLD AND LEASEHOLD REAL ESTATE INVESTMENT TRUST,SET,PROPCON,PF&REIT,
70,KTC,KRUNGTHAI CARD PUBLIC COMPANY LIMITED,SET,FINCIAL,FIN,
71,KTIS,KASET THAI INTERNATIONAL SUGAR CORPORATION PUBLIC COMPANY LIMITED,SET,AGRO,FOOD,
72,KTMS,KT Medical Service Public Company Limited,mai,SERVICE,-,
73,KUMWEL,KUMWELL CORPORATION PUBLIC COMPANY LIMITED,mai,INDUS,-,
74,KUN,VILLA KUNALAI PUBLIC COMPANY LIMITED,mai,PROPCON,-,
75,KWC,KRUNGDHEP SOPHON PUBLIC COMPANY LIMITED,SET,SERVICE,TRANS,
76,KWI,KWI PUBLIC COMPANY LIMITED,SET,FINCIAL,INSUR,
77,KWM,K. W. METAL WORK PUBLIC COMPANY LIMITED,mai,INDUS,-,
78,KYE,KANG YONG ELECTRIC PUBLIC COMPANY LIMITED,SET,CONSUMP,HOME,
79,L&E,LIGHTING & EQUIPMENT PUBLIC COMPANY LIMITED,SET,CONSUMP,HOME,
80,LALIN,LALIN PROPERTY PUBLIC COMPANY LIMITED,SET,PROPCON,PROP,
81,LANNA,THE LANNA RESOURCES PUBLIC COMPANY LIMITED,SET,RESOURC,ENERG,
82,LDC,LDC DENTAL PUBLIC COMPANY LIMITED,mai,SERVICE,-,
83,LEE,LEE FEED MILL PUBLIC COMPANY LIMITED,SET,AGRO,AGRI,
84,LEO,LEO GLOBAL LOGISTICS PUBLIC COMPANY LIMITED,mai,SERVICE,-,
85,LH,LAND AND HOUSES PUBLIC COMPANY LIMITED,SET,PROPCON,PROP,
86,LHFG,LH FINANCIAL GROUP PUBLIC COMPANY LIMITED,SET,FINCIAL,BANK,
87,LHHOTEL,LH HOTEL LEASEHOLD REAL ESTATE INVESTMENT TRUST,SET,PROPCON,PF&REIT,
