88,LHK,LOHAKIT METAL PUBLIC COMPANY LIMITED,SET,INDUS,STEEL,
89,LHPF,LAND AND HOUSES FREEHOLD AND LEASEHOLD PROPERTY FUND,SET,PROPCON,PF&REIT,
90,LHSC,LH SHOPPING CENTERS LEASEHOLD REAL ESTATE INVESTMENT TRUST,SET,PROPCON,PF&REIT,
91,LIT,LEASE IT PUBLIC COMPANY LIMITED,mai,FINCIAL,-,
92,LOXLEY,LOXLEY PUBLIC COMPANY LIMITED,SET,SERVICE,COMM,
93,LPF,LOTUS'S RETAIL GROWTH FREEHOLD AND LEASEHOLD PROPERTY FUND,SET,PROPCON,PF&REIT,
94,LPH,LADPRAO GENERAL HOSPITAL PUBLIC COMPANY LIMITED,SET,SERVICE,HELTH,
95,LPN,L.P.N. DEVELOPMENT PUBLIC COMPANY LIMITED,SET,PROPCON,PROP,
96,LRH,LAGUNA RESORTS & HOTELS PUBLIC COMPANY LIMITED,SET,SERVICE,TOURISM,
97,LST,LAM SOON (THAILAND) PUBLIC COMPANY LIMITED,SET,AGRO,FOOD,
98,LUXF,LUXURY REAL ESTATE INVESTMENT FUND,SET,PROPCON,PF&REIT,
99,M,MK RESTAURANT GROUP PUBLIC COMPANY LIMITED,SET,AGRO,FOOD,
0,MACO,MASTER AD PUBLIC COMPANY LIMITED,SET,SERVICE,MEDIA,
1,MAJOR,MAJOR CINEPLEX GROUP PUBLIC COMPANY LIMITED,SET,SERVICE,MEDIA,
2,MAKRO,SIAM MAKRO PUBLIC COMPANY LIMITED,SET,SERVICE,COMM,
3,MALEE,MALEE GROUP PUBLIC COMPANY LIMITED,SET,AGRO,FOOD,
4,MANRIN,THE MANDARIN HOTEL PUBLIC COMPANY LIMITED,SET,SERVICE,TOURISM,
5,MASTER,Master Style Public Company Limited,mai,SERVICE,-,
6,MATCH,MATCHING MAXIMIZE SOLUTION PUBLIC COMPANY LIMITED,SET,SERVICE,MEDIA,
7,MATI,MATICHON PUBLIC COMPANY LIMITED,SET,SERVICE,MEDIA,
8,MAX,MAX METAL CORPORATION PUBLIC COMPANY LIMITED,SET,AGRO,AGRI,
9,MBAX,MULTIBAX PUBLIC COMPANY LIMITED,mai,INDUS,-,
10,MBK,MBK PUBLIC COMPANY LIMITED,SET,PROPCON,PROP,
11,MC,MC GROUP PUBLIC COMPANY LIMITED,SET,SERVICE,COMM,
12,M-CHAI,MAHACHAI HOSPITAL PUBLIC COMPANY LIMITED,SET,SERVICE,HELTH,
13,MCOT,MCOT PUBLIC COMPANY LIMITED,SET,SERVICE,MEDIA,
14,MCS,M.C.S.STEEL PUBLIC COMPANY LIMITED,SET,INDUS,STEEL,
15,MDX,M.D.X. PUBLIC COMPANY LIMITED,SET,RESOURC,ENERG,
16,MEB,MEB Corporation Public Company Limited,mai,SERVICE,-,
17,MEGA,MEGA LIFESCIENCES PUBLIC COMPANY LIMITED,SET,SERVICE,COMM,
18,MENA,MENA TRANSPORT PUBLIC COMPANY LIMITED,SET,SERVICE,TRANS,
19,META,META CORPORATION PUBLIC COMPANY LIMITED,mai,PROPCON,-,
20,METCO,MURAMOTO ELECTRON (THAILAND) PUBLIC COMPANY LIMITED,SET,TECH,ETRON,
21,MFC,MFC ASSET MANAGEMENT PUBLIC COMPANY LIMITED,SET,FINCIAL,FIN,
22,MFEC,MFEC PUBLIC COMPANY LIMITED,SET,TECH,ICT,
23,MGT,MEGACHEM (THAILAND) PUBLIC COMPANY LIMITED,mai,INDUS,-,
24,MICRO,MICRO LEASING PUBLIC COMPANY LIMITED,SET,FINCIAL,FIN,
25,MIDA,MIDA ASSETS PUBLIC COMPANY LIMITED,SET,SERVICE,COMM,
26,M-II,MFC INDUSTRIAL INVESTMENT PROPERTY AND LEASEHOLD FUND,SET,PROPCON,PF&REIT,
27,MILL,MILLCON STEEL PUBLIC COMPANY LIMITED,SET,INDUS,STEEL,
28,MINT,MINOR INTERNATIONAL PUBLIC COMPANY LIMITED,SET,AGRO,FOOD,
29,MIPF,MILLIONAIRE PROPERTY FUND,SET,PROPCON,PF&REIT,
30,MIT,MFC INDUSTRIAL REAL ESTATE INVESTMENT TRUST,SET,PROPCON,PF&REIT,
31,MITSIB,MITSIB LEASING PUBLIC COMPANY LIMITED,mai,FINCIAL,-,
32,MJD,MAJOR DEVELOPMENT PUBLIC COMPANY LIMITED,SET,PROPCON,PROP,
33,MJLF,MAJOR CINEPLEX LIFESTYLE LEASEHOLD PROPERTY FUND,SET,PROPCON,PF&REIT,
34,MK,M.K. REAL ESTATE DEVELOPMENT PUBLIC COMPANY LIMITED,SET,PROPCON,PROP,
35,ML,"MIDA LEASING PUBLIC CO., LTD.",SET,FINCIAL,FIN,
36,MNIT,MFC-NICHADA THANI PROPERTY FUND,SET,PROPCON,PF&REIT,
37,MNIT2,NICHADA THANI PROPERTY FUND 2,SET,PROPCON,PF&REIT,
38,MNRF,MULTI-NATIONAL RESIDENCE FUND,SET,PROPCON,PF&REIT,
39,MODERN,MODERNFORM GROUP PUBLIC COMPANY LIMITED,SET,CONSUMP,HOME,
40,MONO,MONO NEXT PUBLIC COMPANY LIMITED,SET,SERVICE,MEDIA,
41,MOONG,MOONG PATTANA INTERNATIONAL PUBLIC COMPANY LIMITED,mai,CONSUMP,-,
42,MORE,MORE RETURN PUBLIC COMPANY LIMITED,mai,SERVICE,-,
43,MOSHI,Moshi Moshi Retail Corporation Public Company Limited,SET,SERVICE,COMM,
44,M-PAT,MFC PATONG HERITAGE PROPERTY FUND,SET,PROPCON,PF&REIT,
45,MPIC,M PICTURES ENTERTAINMENT PUBLIC COMPANY LIMITED,SET,SERVICE,MEDIA,
46,MSC,METRO SYSTEMS CORPORATION PUBLIC COMPANY LIMITED,SET,TECH,ICT,
47,MST,MAYBANK SECURITIES (THAILAND) PUBLIC COMPANY LIMITED,SET,FINCIAL,FIN,
48,M-STOR,MFC-STRATEGIC STORAGE FUND,SET,PROPCON,PF&REIT,
49,MTC,MUANGTHAI CAPITAL PUBLIC COMPANY LIMITED,SET,FINCIAL,FIN,
50,MTI,MUANG THAI INSURANCE PUBLIC COMPANY LIMITED,SET,FINCIAL,INSUR,
51,MTW,MAKE TO WIN HOLDING PUBLIC COMPANY LIMITED,mai,INDUS,-,
52,MUD,MUD & HOUND PUBLIC COMPANY LIMITED,mai,AGRO,-,
53,MVP,M VISION PUBLIC COMPANY LIMITED,mai,SERVICE,-,
54,NATION,NATION GROUP (THAILAND) PUBLIC COMPANY LIMITED,SET,SERVICE,MEDIA,
55,NC,NEWCITY (BANGKOK) PUBLIC COMPANY LIMITED,SET,CONSUMP,FASHION,
56,NCAP,NEXT CAPITAL PUBLIC COMPANY LIMITED,SET,FINCIAL,FIN,
57,NCH,N. C. HOUSING PUBLIC COMPANY LIMITED,SET,PROPCON,PROP,
58,NCL,NCL INTERNATIONAL LOGISTICS PUBLIC COMPANY LIMITED,mai,SERVICE,-,
59,NDR,N.D. RUBBER PUBLIC COMPANY LIMITED,mai,INDUS,-,
60,NEP,NEP REALTY AND INDUSTRY PUBLIC COMPANY LIMITED,SET,INDUS,PKG,
61,NER,NORTH EAST RUBBER PUBLIC COMPANY LIMITED,SET,AGRO,AGRI,
62,NETBAY,NETBAY PUBLIC COMPANY LIMITED,mai,TECH,-,
63,NEW,WATTANA KARNPAET PUBLIC COMPANY LIMITED,SET,SERVICE,HELTH,
64,NEWS,NEWS NETWORK CORPORATION PUBLIC COMPANY LIMITED,mai,SERVICE,-,
65,NEX,NEX POINT PUBLIC COMPANY LIMITED,SET,TECH,ETRON,
66,NFC,NFC PUBLIC COMPANY LIMITED,SET,INDUS,PETRO,
67,NINE,NATION INTERNATIONAL EDUTAINMENT PUBLIC COMPANY LIMITED,mai,SERVICE,-,
68,NKI,THE NAVAKIJ INSURANCE PUBLIC COMPANY LIMITED,SET,FINCIAL,INSUR,
69,NNCL,NAVANAKORN PUBLIC COMPANY LIMITED,SET,PROPCON,PROP,
70,NOBLE,NOBLE DEVELOPMENT PUBLIC COMPANY LIMITED,SET,PROPCON,PROP,
71,NOK,NOK AIRLINES PUBLIC COMPANY LIMITED,SET,SERVICE,TRANS,
72,NOVA,NOVA EMPIRE PUBLIC COMPANY LIMITED,SET,RESOURC,ENERG,
73,NPK,NEW PLUS KNITTING PUBLIC COMPANY LIMITED,mai,CONSUMP,-,
74,NRF,NR INSTANT PRODUCE PUBLIC COMPANY LIMITED,SET,AGRO,FOOD,
75,NSI,NAM SENG INSURANCE PUBLIC COMPANY LIMITED,SET,FINCIAL,INSUR,
76,NSL,NSL FOODS PUBLIC COMPANY LIMITED,SET,AGRO,FOOD,
77,NTSC,Nutrition SC Public Company Limited,mai,AGRO,-,
78,NTV,NONTHAVEJ HOSPITAL PUBLIC COMPANY LIMITED,SET,SERVICE,HELTH,
79,NUSA,NUSASIRI PUBLIC COMPANY LIMITED,SET,PROPCON,PROP,
80,NV,NOVA ORGANIC PUBLIC COMPANY LIMITED,SET,CONSUMP,PERSON,
81,NVD,NIRVANA DAII PUBLIC COMPANY LIMITED,SET,PROPCON,PROP,
82,NWR,NAWARAT PATANAKARN PUBLIC COMPANY LIMITED,SET,PROPCON,CONS,
83,NYT,NAMYONG TERMINAL PUBLIC COMPANY LIMITED,SET,SERVICE,TRANS,
84,OCC,O.C.C. PUBLIC COMPANY LIMITED,SET,CONSUMP,PERSON,
85,OGC,OCEAN GLASS PUBLIC COMPANY LIMITED,SET,CONSUMP,HOME,
86,OHTL,OHTL PUBLIC COMPANY LIMITED,SET,SERVICE,TOURISM,
87,OISHI,OISHI GROUP PUBLIC COMPANY LIMITED,SET,AGRO,FOOD,
88,ONEE,THE ONE ENTERPRISE PUBLIC COMPANY LIMITED,SET,SERVICE,MEDIA,
89,OR,PTT OIL AND RETAIL BUSINESS PUBLIC COMPANY LIMITED,SET,RESOURC,ENERG,
90,ORI,ORIGIN PROPERTY PUBLIC COMPANY LIMITED,SET,PROPCON,PROP,
91,OSP,OSOTSPA PUBLIC COMPANY LIMITED,SET,AGRO,FOOD,
92,OTO,ONE TO ONE CONTACTS PUBLIC COMPANY LIMITED,mai,SERVICE,-,
93,PACE,PACE DEVELOPMENT CORPORATION PUBLIC COMPANY LIMITED,SET,PROPCON,PROP,
94,PACO,PRESIDENT AUTOMOBILE INDUSTRIES PUBLIC COMPANY LIMITED,mai,INDUS,-,
95,PAF,PAN ASIA FOOTWEAR PUBLIC COMPANY LIMITED,SET,CONSUMP,FASHION,
96,PAP,PACIFIC PIPE PUBLIC COMPANY LIMITED,SET,INDUS,STEEL,
97,PATO,PATO CHEMICAL INDUSTRY PUBLIC COMPANY LIMITED,SET,INDUS,PETRO,
98,PB,PRESIDENT BAKERY PUBLIC COMPANY LIMITED,SET,AGRO,FOOD,
99,PCC,Precise Corporation Public Company Limited,SET,RESOURC,ENERG,
0,PCSGH,P.C.S. MACHINE GROUP HOLDING PUBLIC COMPANY LIMITED,SET,INDUS,AUTO,
1,PDG,PRODIGY PUBLIC COMPANY LIMITED,mai,INDUS,-,
2,PDJ,PRANDA JEWELRY PUBLIC COMPANY LIMITED,SET,CONSUMP,FASHION,
3,PEACE,PEACE & LIVING PUBLIC COMPANY LIMITED,SET,PROPCON,PROP,
4,PERM,PERMSIN STEEL WORKS PUBLIC COMPANY LIMITED,SET,INDUS,STEEL,
5,PF,PROPERTY PERFECT PUBLIC COMPANY LIMITED,SET,PROPCON,PROP,
6,PG,PEOPLE'S GARMENT PUBLIC COMPANY LIMITED,SET,CONSUMP,FASHION,
7,PHOL,PHOL DHANYA PUBLIC COMPANY LIMITED,mai,SERVICE,-,
8,PICO,PICO (THAILAND) PUBLIC COMPANY LIMITED,mai,SERVICE,-,
9,PIMO,PIONEER MOTOR PUBLIC COMPANY LIMITED,mai,INDUS,-,
10,PIN,PINTHONG INDUSTRIAL PARK PUBLIC COMPANY LIMITED,SET,PROPCON,PROP,
11,PJW,PANJAWATTANA PLASTIC PUBLIC COMPANY LIMITED,mai,INDUS,-,
12,PK,PATKOL PUBLIC COMPANY LIMITED,SET,INDUS,IMM,
13,PL,PHATRA LEASING PUBLIC COMPANY LIMITED,SET,FINCIAL,FIN,
14,PLANB,PLAN B MEDIA PUBLIC COMPANY LIMITED,SET,SERVICE,MEDIA,
15,PLANET,PLANET COMMUNICATIONS ASIA PUBLIC COMPANY LIMITED,mai,TECH,-,
16,PLAT,THE PLATINUM GROUP PUBLIC COMPANY LIMITED,SET,PROPCON,PROP,
17,PLE,POWER LINE ENGINEERING PUBLIC COMPANY LIMITED,SET,PROPCON,CONS,
18,PLUS,Royal Plus Public Company Limited,SET,AGRO,FOOD,
19,PM,PREMIER MARKETING PUBLIC COMPANY LIMITED,SET,AGRO,FOOD,
20,PMTA,PM THORESEN ASIA HOLDINGS PUBLIC COMPANY LIMITED,SET,INDUS,PETRO,
21,POLAR,POLARIS CAPITAL PUBLIC COMPANY LIMITED,SET,PROPCON,PROP,
22,POLY,Polynet Public Company Limited,SET,INDUS,AUTO,
23,POMPUI,KUANG PEI SAN FOOD PRODUCTS PUBLIC COMPANY LIMITED,SET,-,REHABCO,
24,POPF,PRIME OFFICE LEASEHOLD PROPERTY FUND,SET,PROPCON,PF&REIT,
25,PORT,SAHATHAI TERMINAL PUBLIC COMPANY LIMITED,SET,SERVICE,TRANS,
26,POST,BANGKOK POST PUBLIC COMPANY LIMITED,SET,SERVICE,MEDIA,
27,PPF,PINTHONG INDUSTRIAL PARK PROPERTY FUND,SET,PROPCON,PF&REIT,
28,PPM,PORN PROM METAL PUBLIC COMPANY LIMITED,mai,INDUS,-,
29,PPP,PREMIER PRODUCTS PUBLIC COMPANY LIMITED,SET,PROPCON,CONMAT,
30,PPPM,PP PRIME PUBLIC COMPANY LIMITED,SET,AGRO,AGRI,
31,PPS,PROJECT PLANNING SERVICE PUBLIC COMPANY LIMITED,mai,PROPCON,-,
32,PQS,Premier Quality Starch Public Company Limited,SET,AGRO,FOOD,
33,PR9,PRARAM 9 HOSPITAL PUBLIC COMPANY LIMITED,SET,SERVICE,HELTH,
34,PRAKIT,PRAKIT HOLDINGS PUBLIC COMPANY LIMITED,SET,SERVICE,MEDIA,
35,PRAPAT,PEERAPAT TECHNOLOGY PUBLIC COMPANY LIMITED,mai,INDUS,-,
36,PREB,PRE-BUILT PUBLIC COMPANY LIMITED,SET,PROPCON,CONS,
37,PRECHA,PREECHA GROUP PUBLIC COMPANY LIMITED,SET,PROPCON,PROP,
38,PRG,PRG CORPORATION PUBLIC COMPANY LIMITED,SET,AGRO,FOOD,
39,PRI,Primo Service Solutions Public Company Limited,mai,PROPCON,-,
40,PRIME,PRIME ROAD POWER PUBLIC COMPANY LIMITED,SET,RESOURC,ENERG,
41,PRIN,PRINSIRI PUBLIC COMPANY LIMITED,SET,PROPCON,PROP,
42,PRINC,PRINCIPAL CAPITAL PUBLIC COMPANY LIMITED,SET,SERVICE,HELTH,
43,PRM,PRIMA MARINE PUBLIC COMPANY LIMITED,SET,SERVICE,TRANS,
44,PRO,PROFESSIONAL WASTE TECHNOLOGY (1999) PUBLIC COMPANY LIMITED,SET,SERVICE,PROF,
45,PROEN,PROEN CORP PUBLIC COMPANY LIMITED,mai,TECH,-,
46,PROS,PROSPER ENGINEERING PUBLIC COMPANY LIMITED,mai,PROPCON,-,
47,PROSPECT,PROSPECT LOGISTICS AND INDUSTRIAL FREEHOLD AND LEASEHOLD REAL ESTATE INVESTMENT TRUST,SET,PROPCON,PF&REIT,
48,PROUD,PROUD REAL ESTATE PUBLIC COMPANY LIMITED,mai,PROPCON,-,
49,PRTR,PRTR Group Public Company Limited,SET,SERVICE,PROF,
50,PSG,PSG CORPORATION PUBLIC COMPANY LIMITED,mai,PROPCON,-,
51,PSH,PRUKSA HOLDING PUBLIC COMPANY LIMITED,SET,PROPCON,PROP,
52,PSL,PRECIOUS SHIPPING PUBLIC COMPANY LIMITED,SET,SERVICE,TRANS,
53,PSTC,POWER SOLUTION TECHNOLOGIES PUBLIC COMPANY LIMITED,mai,RESOURC,-,
54,PT,PREMIER TECHNOLOGY PUBLIC COMPANY LIMITED,SET,TECH,ICT,
55,PTC,PREMIER TANK CORPORATION PUBLIC COMPANY LIMITED,mai,RESOURC,-,
56,PTECH,PLUS TECH INNOVATION PUBLIC COMPANY LIMITED,SET,SERVICE,MEDIA,
57,PTG,PTG ENERGY PUBLIC COMPANY LIMITED,SET,RESOURC,ENERG,
58,PTL,POLYPLEX (THAILAND) PUBLIC COMPANY LIMITED,SET,INDUS,PKG,
59,PTT,PTT PUBLIC COMPANY LIMITED,SET,RESOURC,ENERG,
60,PTTEP,PTT EXPLORATION AND PRODUCTION PUBLIC COMPANY LIMITED,SET,RESOURC,ENERG,
61,PTTGC,PTT GLOBAL CHEMICAL PUBLIC COMPANY LIMITED,SET,INDUS,PETRO,
62,PYLON,PYLON PUBLIC COMPANY LIMITED,SET,PROPCON,CONS,
63,Q-CON,QUALITY CONSTRUCTION PRODUCTS PUBLIC COMPANY LIMITED,SET,PROPCON,CONMAT,
64,QH,QUALITY HOUSES PUBLIC COMPANY LIMITED,SET,PROPCON,PROP,
65,QHHR,QUALITY HOUSES HOTEL AND RESIDENCE FREEHOLD AND LEASEHOLD PROPERTY FUND,SET,PROPCON,PF&REIT,
66,QHOP,QUALITY HOSPITALITY LEASEHOLD PROPERTY FUND,SET,PROPCON,PF&REIT,
67,QHPF,QUALITY HOUSES LEASEHOLD PROPERTY FUND,SET,PROPCON,PF&REIT,
68,QLT,QUALITECH PUBLIC COMPANY LIMITED,mai,SERVICE,-,
69,QTC,QTC ENERGY PUBLIC COMPANY LIMITED,SET,RESOURC,ENERG,
70,RABBIT,RABBIT HOLDINGS PUBLIC COMPANY LIMITED,SET,PROPCON,PROP,
71,RAM,RAMKHAMHAENG HOSPITAL PUBLIC COMPANY LIMITED,SET,SERVICE,HELTH,
72,RATCH,RATCH GROUP PUBLIC COMPANY LIMITED,SET,RESOURC,ENERG,
73,RBF,R&B FOOD SUPPLY PUBLIC COMPANY LIMITED,SET,AGRO,FOOD,
74,RCL,REGIONAL CONTAINER LINES PUBLIC COMPANY LIMITED,SET,SERVICE,TRANS,
75,READY,READYPLANET PUBLIC COMPANY LIMITED,mai,TECH,-,
76,RICHY,RICHY PLACE 2002 PUBLIC COMPANY LIMITED,SET,PROPCON,PROP,
77,RJH,RAJTHANEE HOSPITAL PUBLIC COMPANY LIMITED,SET,SERVICE,HELTH,
78,RML,RAIMON LAND PUBLIC COMPANY LIMITED,SET,PROPCON,PROP,
79,ROCK,ROCKWORTH PUBLIC COMPANY LIMITED,SET,CONSUMP,HOME,
80,ROH,ROYAL ORCHID HOTEL (THAILAND) PUBLIC COMPANY LIMITED,SET,SERVICE,TOURISM,
81,ROJNA,ROJANA INDUSTRIAL PARK PUBLIC COMPANY LIMITED,SET,PROPCON,PROP,
82,RP,RAJA FERRY PORT PUBLIC COMPANY LIMITED,mai,SERVICE,-,
83,RPC,RPCG PUBLIC COMPANY LIMITED,SET,RESOURC,ENERG,
84,RPH,RATCHAPHRUEK HOSPITAL PUBLIC COMPANY LIMITED,SET,SERVICE,HELTH,
85,RS,RS PUBLIC COMPANY LIMITED,SET,SERVICE,COMM,
86,RSP,RICH SPORT PUBLIC COMPANY LIMITED,SET,SERVICE,COMM,
87,RT,RIGHT TUNNELLING PUBLIC COMPANY LIMITED,SET,PROPCON,CONS,
88,RWI,RAYONG WIRE INDUSTRIES PUBLIC COMPANY LIMITED,mai,INDUS,-,
89,S,SINGHA ESTATE PUBLIC COMPANY LIMITED,SET,PROPCON,PROP,
90,S&J,S & J INTERNATIONAL ENTERPRISES PUBLIC COMPANY LIMITED,SET,CONSUMP,PERSON,
91,S11,S 11 GROUP PUBLIC COMPANY LIMITED,SET,FINCIAL,FIN,
92,SA,SIAMESE ASSET PUBLIC COMPANY LIMITED,SET,PROPCON,PROP,
93,SAAM,SAAM DEVELOPMENT PUBLIC COMPANY LIMITED,mai,RESOURC,-,
94,SABINA,SABINA PUBLIC COMPANY LIMITED,SET,CONSUMP,FASHION,
95,SABUY,SABUY TECHNOLOGY PUBLIC COMPANY LIMITED,SET,SERVICE,COMM,
96,SAF,S.A.F. SPECIAL STEEL PUBLIC COMPANY LIMITED,mai,INDUS,-,
97,SAFARI,SAFARI WORLD PUBLIC COMPANY LIMITED,SET,-,REHABCO,
98,SAK,SAKSIAM LEASING PUBLIC COMPANY LIMITED,SET,FINCIAL,FIN,
99,SALEE,SALEE INDUSTRY PUBLIC COMPANY LIMITED,mai,INDUS,-,
0,SAM,SAMCHAI STEEL INDUSTRIES PUBLIC COMPANY LIMITED,SET,INDUS,STEEL,
1,SAMART,SAMART CORPORATION PUBLIC COMPANY LIMITED,SET,TECH,ICT,
2,SAMCO,SAMMAKORN PUBLIC COMPANY LIMITED,SET,PROPCON,PROP,
3,SAMTEL,SAMART TELCOMS PUBLIC COMPANY LIMITED,SET,TECH,ICT,
4,SANKO,SANKO DIECASTING (THAILAND) PUBLIC COMPANY LIMITED,mai,INDUS,-,
5,SAPPE,SAPPE PUBLIC COMPANY LIMITED,SET,AGRO,FOOD,
6,SAT,SOMBOON ADVANCE TECHNOLOGY PUBLIC COMPANY LIMITED,SET,INDUS,AUTO,
7,SAUCE,THAITHEPAROS PUBLIC COMPANY LIMITED,SET,AGRO,FOOD,
8,SAWAD,SRISAWAD CORPORATION PUBLIC COMPANY LIMITED,SET,FINCIAL,FIN,
9,SAWANG,SAWANG EXPORT PUBLIC COMPANY LIMITED,SET,CONSUMP,FASHION,
10,SC,SC ASSET CORPORATION PUBLIC COMPANY LIMITED,SET,PROPCON,PROP,
11,SCAP,SRISAWAD CAPITAL 1969 PUBLIC COMPANY LIMITED,SET,FINCIAL,FIN,
12,SCB,SCB X PUBLIC COMPANY LIMITED,SET,FINCIAL,BANK,
13,SCC,THE SIAM CEMENT PUBLIC COMPANY LIMITED,SET,PROPCON,CONMAT,
14,SCCC,SIAM CITY CEMENT PUBLIC COMPANY LIMITED,SET,PROPCON,CONMAT,
15,SCG,SAHACOGEN (CHONBURI) PUBLIC COMPANY LIMITED,SET,RESOURC,ENERG,
16,SCGP,SCG PACKAGING PUBLIC COMPANY LIMITED,SET,INDUS,PKG,
17,SCI,SCI ELECTRIC PUBLIC COMPANY LIMITED,SET,RESOURC,ENERG,
18,SCM,SUCCESSMORE BEING PUBLIC COMPANY LIMITED,SET,SERVICE,COMM,
19,SCN,SCAN INTER PUBLIC COMPANY LIMITED,SET,RESOURC,ENERG,
20,SCP,SOUTHERN CONCRETE PILE PUBLIC COMPANY LIMITED,SET,PROPCON,CONMAT,
21,SDC,SAMART DIGITAL PUBLIC COMPANY LIMITED,SET,TECH,ICT,
22,SE,SIAMEAST SOLUTIONS PUBLIC COMPANY LIMITED,mai,SERVICE,-,
23,SEAFCO,SEAFCO PUBLIC COMPANY LIMITED,SET,PROPCON,CONS,
24,SEAOIL,SEA OIL PUBLIC COMPANY LIMITED,mai,RESOURC,-,
25,SECURE,NFORCE SECURE PUBLIC COMPANY LIMITED,mai,TECH,-,
26,SE-ED,SE-EDUCATION PUBLIC COMPANY LIMITED,SET,SERVICE,MEDIA,
27,SELIC,SELIC CORP PUBLIC COMPANY LIMITED,mai,INDUS,-,
28,SENA,SENADEVELOPMENT PUBLIC COMPANY LIMITED,SET,PROPCON,PROP,
29,SENAJ,SENA J PROPERTY PUBLIC COMPANY LIMITED,mai,PROPCON,-,
30,SFLEX,STARFLEX PUBLIC COMPANY LIMITED,SET,INDUS,PKG,
31,SFP,SIAM FOOD PRODUCTS PUBLIC COMPANY LIMITED,SET,AGRO,FOOD,
32,SFT,SHRINKFLEX (THAILAND) PUBLIC COMPANY LIMITED,mai,INDUS,-,
33,SGC,SG Capital Public Company Limited,SET,FINCIAL,FIN,
34,SGF,SGF CAPITAL PUBLIC COMPANY LIMITED,mai,FINCIAL,-,
35,SGP,SIAMGAS AND PETROCHEMICALS PUBLIC COMPANY LIMITED,SET,RESOURC,ENERG,
36,SHANG,SHANGRI-LA HOTEL PUBLIC COMPANY LIMITED,SET,SERVICE,TOURISM,
37,SHR,S HOTELS AND RESORTS PUBLIC COMPANY LIMITED,SET,SERVICE,TOURISM,
38,SHREIT,STRATEGIC HOSPITALITY EXTENDABLE FREEHOLD AND LEASEHOLD REAL ESTATE INVESTMENT TRUST,SET,PROPCON,PF&REIT,
39,SIAM,SIAM STEEL INTERNATIONAL PUBLIC COMPANY LIMITED,SET,CONSUMP,HOME,
40,SICT,SILICON CRAFT TECHNOLOGY PUBLIC COMPANY LIMITED,mai,TECH,-,
41,SIMAT,SIMAT TECHNOLOGIES PUBLIC COMPANY LIMITED,mai,TECH,-,
42,SINGER,SINGER THAILAND PUBLIC COMPANY LIMITED,SET,SERVICE,COMM,
43,SIRI,SANSIRI PUBLIC COMPANY LIMITED,SET,PROPCON,PROP,
44,SIRIP,SIRI PRIME OFFICE PROPERTY FUND,SET,PROPCON,PF&REIT,
45,SIS,SIS DISTRIBUTION (THAILAND) PUBLIC COMPANY LIMITED,SET,TECH,ICT,
46,SISB,SISB PUBLIC COMPANY LIMITED,SET,SERVICE,PROF,
47,SITHAI,SRITHAI SUPERWARE PUBLIC COMPANY LIMITED,SET,INDUS,PKG,
48,SJWD,SCGJWD LOGISTICS PUBLIC COMPANY LIMITED,SET,SERVICE,TRANS,
49,SK,SIRAKORN PUBLIC COMPANY LIMITED,mai,PROPCON,-,
50,SKE,SAKOL ENERGY PUBLIC COMPANY LIMITED,SET,RESOURC,ENERG,
51,SKN,S.KIJCHAI ENTERPRISE PUBLIC COMPANY LIMITED,SET,PROPCON,CONMAT,
52,SKR,SIKARIN PUBLIC COMPANY LIMITED,SET,SERVICE,HELTH,
53,SKY,SKY ICT PUBLIC COMPANY LIMITED,SET,TECH,ICT,
54,SLM,SLM CORPORATION PUBLIC COMPANY LIMITED,mai,SERVICE,-,
55,SLP,SALEE PRINTING PUBLIC COMPANY LIMITED,SET,INDUS,PKG,
56,SM,STAR MONEY PUBLIC COMPANY LIMITED,SET,FINCIAL,FIN,
57,SMART,SMART CONCRETE PUBLIC COMPANY LIMITED,mai,PROPCON,-,
58,SMD,SAINTMED PUBLIC COMPANY LIMITED,mai,CONSUMP,-,
59,SMIT,SAHAMIT MACHINERY PUBLIC COMPANY LIMITED,SET,INDUS,STEEL,
60,SMK,SYN MUN KONG INSURANCE PUBLIC COMPANY LIMITED,SET,FINCIAL,INSUR,
61,SMPC,SAHAMITR PRESSURE CONTAINER PUBLIC COMPANY LIMITED,SET,INDUS,PKG,
62,SMT,STARS MICROELECTRONICS (THAILAND) PUBLIC COMPANY LIMITED,SET,TECH,ETRON,
63,SNC,SNC FORMER PUBLIC COMPANY LIMITED,SET,INDUS,IMM,
64,SNNP,SRINANAPORN MARKETING PUBLIC COMPANY LIMITED,SET,AGRO,FOOD,
65,SNP,S & P SYNDICATE PUBLIC COMPANY LIMITED,SET,AGRO,FOOD,
66,SO,SIAMRAJATHANEE PUBLIC COMPANY LIMITED,SET,SERVICE,PROF,
67,SOLAR,SOLARTRON PUBLIC COMPANY LIMITED,SET,RESOURC,ENERG,
68,SONIC,SONIC INTERFREIGHT PUBLIC COMPANY LIMITED,mai,SERVICE,-,
69,SORKON,S. KHONKAEN FOODS PUBLIC COMPANY LIMITED,SET,AGRO,FOOD,
70,SPA,SIAM WELLNESS GROUP PUBLIC COMPANY LIMITED,mai,SERVICE,-,
71,SPACK,S. PACK & PRINT PUBLIC COMPANY LIMITED,SET,INDUS,PKG,
72,SPALI,SUPALAI PUBLIC COMPANY LIMITED,SET,PROPCON,PROP,
73,SPC,SAHA PATHANAPIBUL PUBLIC COMPANY LIMITED,SET,SERVICE,COMM,
74,SPCG,SPCG PUBLIC COMPANY LIMITED,SET,RESOURC,ENERG,
75,SPG,THE SIAM PAN GROUP PUBLIC COMPANY LIMITED,SET,INDUS,AUTO,
76,SPI,SAHA PATHANA INTER-HOLDING PUBLIC COMPANY LIMITED,SET,SERVICE,COMM,
77,SPRC,STAR PETROLEUM REFINING PUBLIC COMPANY LIMITED,SET,RESOURC,ENERG,
78,SPRIME,S PRIME GROWTH LEASEHOLD REAL ESTATE INVESTMENT TRUST,SET,PROPCON,PF&REIT,
79,SPVI,S P V I PUBLIC COMPANY LIMITED,mai,TECH,-,
80,SQ,SAHAKOL EQUIPMENT PUBLIC COMPANY LIMITED,SET,PROPCON,CONS,
81,SR,SIAMRAJ PUBLIC COMPANY LIMITED,mai,RESOURC,-,
82,SRICHA,SRIRACHA CONSTRUCTION PUBLIC COMPANY LIMITED,SET,PROPCON,CONS,
83,SRIPANWA,SRI PANWA HOSPITALITY REAL ESTATE INVESTMENT TRUST,SET,PROPCON,PF&REIT,
84,SSC,SERMSUK PUBLIC COMPANY LIMITED,SET,AGRO,FOOD,
85,SSF,SURAPON FOODS PUBLIC COMPANY LIMITED,SET,AGRO,FOOD,
86,SSP,SERMSANG POWER CORPORATION PUBLIC COMPANY LIMITED,SET,RESOURC,ENERG,
87,SSPF,SALA @ SATHORN PROPERTY FUND,SET,PROPCON,PF&REIT,
88,SSS,STAR SITTHI SOLUTION PUBLIC COMPANY LIMITED,mai,PROPCON,-,
89,SSSC,SIAM STEEL SERVICE CENTER PUBLIC COMPANY LIMITED,SET,INDUS,STEEL,
90,SST,SUB SRI THAI PUBLIC COMPANY LIMITED,SET,AGRO,FOOD,
91,SSTRT,SUB SRI THAI REAL ESTATE INVESTMENT TRUST,SET,PROPCON,PF&REIT,
92,STA,SRI TRANG AGRO-INDUSTRY PUBLIC COMPANY LIMITED,SET,AGRO,AGRI,
93,STANLY,THAI STANLEY ELECTRIC PUBLIC COMPANY LIMITED,SET,INDUS,AUTO,
94,STARK,STARK CORPORATION PUBLIC COMPANY LIMITED,SET,INDUS,IMM,
95,STC,STC CONCRETE PRODUCT PUBLIC COMPANY LIMITED,mai,PROPCON,-,
96,STEC,"SINO-THAI ENGINEERING AND CONSTRUCTION PUBLIC CO.,LTD.",SET,PROPCON,CONS,
97,STECH,SIAM TECHNIC CONCRETE PUBLIC COMPANY LIMITED,SET,PROPCON,CONMAT,
98,STGT,SRI TRANG GLOVES (THAILAND) PUBLIC COMPANY LIMITED,SET,CONSUMP,PERSON,
99,STHAI,"SHUN THAI RUBBER GLOVES INDUSTRY PUBLIC CO., LTD",SET,CONSUMP,PERSON,
0,STI,STONEHENGE INTER PUBLIC COMPANY LIMITED,SET,PROPCON,CONS,
1,STOWER,SKY TOWER PUBLIC COMPANY LIMITED,mai,RESOURC,-,
2,STP,SAHATHAI PRINTING & PACKAGING PUBLIC COMPANY LIMITED,mai,INDUS,-,
3,STPI,STP&I PUBLIC COMPANY LIMITED,SET,PROPCON,CONS,
4,SUC,SAHA-UNION PUBLIC COMPANY LIMITED,SET,CONSUMP,FASHION,
5,SUN,SUNSWEET PUBLIC COMPANY LIMITED,SET,AGRO,FOOD,
6,SUPER,SUPER ENERGY CORPORATION PUBLIC COMPANY LIMITED,SET,RESOURC,ENERG,
7,SUPEREIF,SUPER ENERGY POWER PLANT INFRASTRUCTURE FUND,SET,RESOURC,ENERG,
8,SUSCO,SUSCO PUBLIC COMPANY LIMITED,SET,RESOURC,ENERG,
9,SUTHA,GOLDEN LIME PUBLIC COMPANY LIMITED,SET,INDUS,PETRO,
10,SVI,SVI PUBLIC COMPANY LIMITED,SET,TECH,ETRON,
11,SVOA,SVOA PUBLIC COMPANY LIMITED,SET,TECH,ICT,
12,SVR,SIVAROM REAL ESTATE PUBLIC COMPANY LIMITED,mai,PROPCON,-,
13,SVT,SUN VENDING TECHNOLOGY PUBLIC COMPANY LIMITED,SET,SERVICE,COMM,
14,SWC,SHERWOOD CORPORATION (THAILAND) PUBLIC COMPANY LIMITED,mai,INDUS,-,
15,SYMC,SYMPHONY COMMUNICATION PUBLIC COMPANY LIMITED,SET,TECH,ICT,
16,SYNEX,SYNNEX (THAILAND) PUBLIC COMPANY LIMITED,SET,TECH,ICT,
17,SYNTEC,SYNTEC CONSTRUCTION PUBLIC COMPANY LIMITED,SET,PROPCON,CONS,
18,TACC,T.A.C. CONSUMER PUBLIC COMPANY LIMITED,mai,AGRO,-,
19,TAE,THAI AGRO ENERGY PUBLIC COMPANY LIMITED,SET,RESOURC,ENERG,
20,TAKUNI,TAKUNI GROUP PUBLIC COMPANY LIMITED,mai,RESOURC,-,
21,TAPAC,TAPACO PUBLIC COMPANY LIMITED,mai,PROPCON,-,
22,TASCO,TIPCO ASPHALT PUBLIC COMPANY LIMITED,SET,PROPCON,CONMAT,
23,TC,TROPICAL CANNING (THAILAND) PUBLIC COMPANY LIMITED,SET,AGRO,FOOD,
24,TCAP,THANACHART CAPITAL PUBLIC COMPANY LIMITED,SET,FINCIAL,BANK,
25,TCC,THAI CAPITAL CORPORATION PUBLIC COMPANY LIMITED,SET,RESOURC,ENERG,
26,TCCC,THAI CENTRAL CHEMICAL PUBLIC COMPANY LIMITED,SET,INDUS,PETRO,
27,TCJ,T.C.J. ASIA PUBLIC COMPANY LIMITED,SET,INDUS,IMM,
28,TCMC,TCM CORPORATION PUBLIC COMPANY LIMITED,SET,CONSUMP,HOME,
29,TCOAT,THAI COATING INDUSTRIAL PUBLIC COMPANY LIMITED,SET,INDUS,PKG,
30,TEAM,TEAM PRECISION PUBLIC COMPANY LIMITED,SET,TECH,ETRON,
31,TEAMG,TEAM CONSULTING ENGINEERING AND MANAGEMENT PUBLIC COMPANY LIMITED,SET,PROPCON,CONS,
32,TEGH,Thai Eastern Group Holdings Public Company Limited,SET,AGRO,AGRI,
33,TEKA,TEKA CONSTRUCTION PUBLIC COMPANY LIMITED,SET,PROPCON,CONS,
34,TFFIF,THAILAND FUTURE FUND,SET,SERVICE,TRANS,
35,TFG,THAIFOODS GROUP PUBLIC COMPANY LIMITED,SET,AGRO,FOOD,
36,TFI,THAI FILM INDUSTRIES PUBLIC COMPANY LIMITED,SET,INDUS,PKG,
37,TFM,THAI UNION FEEDMILL PUBLIC COMPANY LIMITED,SET,AGRO,AGRI,
38,TFMAMA,THAI PRESIDENT FOODS PUBLIC COMPANY LIMITED,SET,AGRO,FOOD,
39,TGE,THACHANG GREEN ENERGY PUBLIC COMPANY LIMITED,SET,RESOURC,ENERG,
40,TGH,THAI GROUP HOLDINGS PUBLIC COMPANY LIMITED,SET,FINCIAL,INSUR,
41,TGPRO,THAI-GERMAN PRODUCTS PUBLIC COMPANY LIMITED,SET,INDUS,STEEL,
42,TH,TONG HUA HOLDING PUBLIC COMPANY LIMITED,SET,FINCIAL,FIN,
43,THAI,THAI AIRWAYS INTERNATIONAL PUBLIC COMPANY LIMITED,SET,SERVICE,TRANS,
44,THANA,THANASIRI GROUP PUBLIC COMPANY LIMITED,mai,PROPCON,-,
45,THANI,RATCHTHANI LEASING PUBLIC COMPANY LIMITED,SET,FINCIAL,FIN,
46,THCOM,THAICOM PUBLIC COMPANY LIMITED,SET,TECH,ICT,
47,THE,THE STEEL PUBLIC COMPANY LIMITED,SET,INDUS,STEEL,
48,THG,THONBURI HEALTHCARE GROUP PUBLIC COMPANY LIMITED,SET,SERVICE,HELTH,
49,THIP,THANTAWAN INDUSTRY PUBLIC COMPANY LIMITED,SET,INDUS,PKG,
50,THL,TONGKAH HARBOUR PUBLIC COMPANY LIMITED,SET,RESOURC,MINE,
51,THMUI,THAI MUI CORPORATION PUBLIC COMPANY LIMITED,mai,SERVICE,-,
52,THRE,THAI REINSURANCE PUBLIC COMPANY LIMITED,SET,FINCIAL,INSUR,
53,THREL,THAIRE LIFE ASSURANCE PUBLIC COMPANY LIMITED,SET,FINCIAL,INSUR,
54,TIDLOR,NGERN TID LOR PUBLIC COMPANY LIMITED,SET,FINCIAL,FIN,
55,TIF1,THAI INDUSTRIAL FUND 1,SET,PROPCON,PF&REIT,
56,TIGER,THAI ENGER HOLDING PUBLIC COMPANY LIMITED,mai,PROPCON,-,
57,TIPCO,TIPCO FOODS PUBLIC COMPANY LIMITED,SET,AGRO,FOOD,
58,TIPH,DHIPAYA GROUP HOLDINGS PUBLIC COMPANY LIMITED,SET,FINCIAL,INSUR,
59,TISCO,TISCO FINANCIAL GROUP PUBLIC COMPANY LIMITED,SET,FINCIAL,BANK,
60,TITLE,RHOM BHO PROPERTY PUBLIC COMPANY LIMITED,mai,PROPCON,-,
61,TK,THITIKORN PUBLIC COMPANY LIMITED,SET,FINCIAL,FIN,
62,TKC,TURNKEY COMMUNICATION SERVICES PUBLIC COMPANY LIMITED,SET,TECH,ICT,
63,TKN,TAOKAENOI FOOD & MARKETING PUBLIC COMPANY LIMITED,SET,AGRO,FOOD,
64,TKS,T.K.S. TECHNOLOGIES PUBLIC COMPANY LIMITED,SET,SERVICE,MEDIA,
65,TKT,T.KRUNGTHAI INDUSTRIES PUBLIC COMPANY LIMITED,SET,INDUS,AUTO,
66,TLHPF,THAILAND HOSPITALITY PROPERTY FUND,SET,PROPCON,PF&REIT,
67,TLI,THAI LIFE INSURANCE PUBLIC COMPANY LIMITED,SET,FINCIAL,INSUR,
68,TM,TECHNO MEDICAL PUBLIC COMPANY LIMITED,mai,CONSUMP,-,
69,TMC,T.M.C. INDUSTRIAL PUBLIC COMPANY LIMITED,mai,INDUS,-,
70,TMD,THAI METAL DRUM MANUFACTURING PUBLIC COMPANY LIMITED,SET,INDUS,PKG,
71,TMI,TEERA-MONGKOL INDUSTRY PUBLIC COMPANY LIMITED,mai,INDUS,-,
72,TMILL,T S FLOUR MILL PUBLIC COMPANY LIMITED,mai,AGRO,-,
73,TMT,TMT STEEL PUBLIC COMPANY LIMITED,SET,INDUS,STEEL,
74,TMW,THAI MITSUWA PUBLIC COMPANY LIMITED,mai,INDUS,-,
75,TNDT,THAI NONDESTRUCTIVE TESTING PUBLIC COMPANY LIMITED,mai,SERVICE,-,
76,TNH,THAI NAKARIN HOSPITAL PUBLIC COMPANY LIMITED,mai,SERVICE,-,
77,TNITY,TRINITY WATTHANA PUBLIC COMPANY LIMITED,SET,FINCIAL,FIN,
78,TNL,THANULUX PUBLIC COMPANY LIMITED,SET,CONSUMP,FASHION,
79,TNP,THANAPIRIYA PUBLIC COMPANY LIMITED,mai,SERVICE,-,
80,TNPC,THAI NAM PLASTIC PUBLIC COMPANY LIMITED,SET,INDUS,AUTO,
81,TNPF,TRINITY FREEHOLD AND LEASEHOLD PROPERTY FUND,SET,PROPCON,PF&REIT,
82,TNR,THAI NIPPON RUBBER INDUSTRY PUBLIC COMPANY LIMITED,SET,CONSUMP,PERSON,
83,TOA,TOA PAINT (THAILAND) PUBLIC COMPANY LIMITED,SET,PROPCON,CONMAT,
84,TOG,THAI OPTICAL GROUP PUBLIC COMPANY LIMITED,SET,CONSUMP,PERSON,
