85,TOP,THAI OIL PUBLIC COMPANY LIMITED,SET,RESOURC,ENERG,
86,TOPP,THAI O.P.P. PUBLIC COMPANY LIMITED,SET,INDUS,PKG,
87,TPA,THAI POLY ACRYLIC PUBLIC COMPANY LIMITED,SET,INDUS,PETRO,
88,TPAC,THAI PLASPAC PUBLIC COMPANY LIMITED,SET,INDUS,PKG,
89,TPBI,TPBI PUBLIC COMPANY LIMITED,SET,INDUS,PKG,
90,TPCH,TPC POWER HOLDING PUBLIC COMPANY LIMITED,mai,RESOURC,-,
91,TPCS,TPCS PUBLIC COMPANY LIMITED,SET,INDUS,IMM,
92,TPIPL,TPI POLENE PUBLIC COMPANY LIMITED,SET,PROPCON,CONMAT,
93,TPIPP,TPI POLENE POWER PUBLIC COMPANY LIMITED,SET,RESOURC,ENERG,
94,TPLAS,THAI PLASTIC INDUSTRIAL (1994) PUBLIC COMPANY LIMITED,mai,INDUS,-,
95,TPOLY,THAI POLYCONS PUBLIC COMPANY LIMITED,SET,PROPCON,CONS,
96,TPP,THAI PACKAGING & PRINTING PUBLIC COMPANY LIMITED,SET,INDUS,PKG,
97,TPRIME,THAILAND PRIME PROPERTY FREEHOLD AND LEASEHOLD REAL ESTATE INVESTMENT TRUST,SET,PROPCON,PF&REIT,
98,TPS,THE PRACTICAL SOLUTION PUBLIC COMPANY LIMITED,mai,TECH,-,
99,TQM,TQM ALPHA PUBLIC COMPANY LIMITED,SET,FINCIAL,INSUR,
0,TQR,TQR PUBLIC COMPANY LIMITED,mai,FINCIAL,-,
1,TR,THAI RAYON PUBLIC COMPANY LIMITED,SET,CONSUMP,FASHION,
2,TRC,TRC CONSTRUCTION PUBLIC COMPANY LIMITED,SET,PROPCON,CONS,
3,TRITN,TRITON HOLDING PUBLIC COMPANY LIMITED,SET,PROPCON,CONS,
4,TRT,TIRATHAI PUBLIC COMPANY LIMITED,mai,RESOURC,-,
5,TRU,THAI RUNG UNION CAR PUBLIC COMPANY LIMITED,SET,INDUS,AUTO,
6,TRUBB,THAI RUBBER LATEX GROUP PUBLIC COMPANY LIMITED,SET,AGRO,AGRI,
7,TRUE,TRUE CORPORATION PUBLIC COMPANY LIMITED,SET,TECH,ICT,
8,TRV,T.R.V. RUBBER PRODUCTS PUBLIC COMPANY LIMITED,mai,INDUS,-,
9,TSC,THAI STEEL CABLE PUBLIC COMPANY LIMITED,SET,INDUS,AUTO,
10,TSE,THAI SOLAR ENERGY PUBLIC COMPANY LIMITED,SET,RESOURC,ENERG,
11,TSF,THREE SIXTY FIVE PUBLIC COMPANY LIMITED,mai,SERVICE,-,
12,TSI,THE THAI SETAKIJ INSURANCE PUBLIC COMPANY LIMITED,SET,FINCIAL,INSUR,
13,TSR,THIENSURAT PUBLIC COMPANY LIMITED,SET,CONSUMP,HOME,
14,TSTE,THAI SUGAR TERMINAL PUBLIC COMPANY LIMITED,SET,SERVICE,TRANS,
15,TSTH,TATA STEEL (THAILAND) PUBLIC COMPANY LIMITED,SET,INDUS,STEEL,
16,TTA,THORESEN THAI AGENCIES PUBLIC COMPANY LIMITED,SET,SERVICE,TRANS,
17,TTB,TMBTHANACHART BANK PUBLIC COMPANY LIMITED,SET,FINCIAL,BANK,
18,TTCL,TTCL PUBLIC COMPANY LIMITED,SET,PROPCON,CONS,
19,TTI,THAI TEXTILE INDUSTRY PUBLIC COMPANY LIMITED,SET,CONSUMP,FASHION,
20,TTLPF,TALAAD THAI LEASEHOLD PROPERTY FUND,SET,PROPCON,PF&REIT,
21,TTT,TORAY TEXTILES (THAILAND) PUBLIC COMPANY LIMITED,SET,CONSUMP,FASHION,
22,TTW,TTW PUBLIC COMPANY LIMITED,SET,RESOURC,ENERG,
23,TU,THAI UNION GROUP PUBLIC COMPANY LIMITED,SET,AGRO,FOOD,
24,TU-PF,T.U. DOME RESIDENTIAL COMPLEX LEASEHOLD PROPERTY FUND,SET,PROPCON,PF&REIT,
25,TVDH,TVD HOLDINGS PUBLIC COMPANY LIMITED,mai,SERVICE,-,
26,TVI,THAIVIVAT INSURANCE PUBLIC COMPANY LIMITED,SET,FINCIAL,INSUR,
27,TVO,THAI VEGETABLE OIL PUBLIC COMPANY LIMITED,SET,AGRO,FOOD,
28,TVT,TV THUNDER PUBLIC COMPANY LIMITED,mai,SERVICE,-,
29,TWP,THAI WIRE PRODUCTS PUBLIC COMPANY LIMITED,SET,INDUS,STEEL,
30,TWPC,THAI WAH PUBLIC COMPANY LIMITED,SET,AGRO,AGRI,
31,TWZ,TWZ CORPORATION PUBLIC COMPANY LIMITED,SET,TECH,ICT,
32,TYCN,"TYCOONS WORLDWIDE GROUP (THAILAND) PUBLIC CO.,LTD.",SET,INDUS,STEEL,
33,UAC,UAC GLOBAL PUBLIC COMPANY LIMITED,SET,INDUS,PETRO,
34,UBA,Utility Business Alliance Public Company Limited,mai,SERVICE,-,
35,UBE,UBON BIO ETHANOL PUBLIC COMPANY LIMITED,SET,RESOURC,ENERG,
36,UBIS,UBIS (ASIA) PUBLIC COMPANY LIMITED,mai,INDUS,-,
37,UEC,UNIMIT ENGINEERING PUBLIC COMPANY LIMITED,mai,INDUS,-,
38,UKEM,UNION PETROCHEMICAL PUBLIC COMPANY LIMITED,mai,INDUS,-,
39,UMI,THE UNION MOSAIC INDUSTRY PUBLIC COMPANY LIMITED,SET,PROPCON,CONMAT,
40,UMS,UNIQUE MINING SERVICES PUBLIC COMPANY LIMITED,mai,RESOURC,-,
41,UNIQ,UNIQUE ENGINEERING AND CONSTRUCTION PUBLIC COMPANY LIMITED,SET,PROPCON,CONS,
42,UOBKH,UOB KAY HIAN SECURITIES (THAILAND) PUBLIC COMPANY LIMITED,SET,FINCIAL,FIN,
43,UP,UNION PLASTIC PUBLIC COMPANY LIMITED,SET,INDUS,PETRO,
44,UPF,UNION PIONEER PUBLIC COMPANY LIMITED,SET,CONSUMP,FASHION,
45,UPOIC,UNITED PALM OIL INDUSTRY PUBLIC COMPANY LIMITED,SET,AGRO,AGRI,
46,URBNPF,URBANA PROPERTY FUND (LEASE HOLD),SET,PROPCON,PF&REIT,
47,UREKA,EUREKA DESIGN PUBLIC COMPANY LIMITED,mai,INDUS,-,
48,UTP,UNITED PAPER PUBLIC COMPANY LIMITED,SET,INDUS,PAPER,
49,UV,UNIVENTURES PUBLIC COMPANY LIMITED,SET,PROPCON,PROP,
50,UVAN,UNIVANICH PALM OIL PUBLIC COMPANY LIMITED,SET,AGRO,AGRI,
51,VARO,VAROPAKORN PUBLIC COMPANY LIMITED,SET,INDUS,IMM,
52,VCOM,VINTCOM TECHNOLOGY PUBLIC COMPANY LIMITED,mai,TECH,-,
53,VGI,VGI PUBLIC COMPANY LIMITED,SET,SERVICE,MEDIA,
54,VIBHA,VIBHAVADI MEDICAL CENTER PUBLIC COMPANY LIMITED,SET,SERVICE,HELTH,
55,VIH,SRIVICHAIVEJVIVAT PUBLIC COMPANY LIMITED,SET,SERVICE,HELTH,
56,VL,V.L. ENTERPRISE PUBLIC COMPANY LIMITED,mai,SERVICE,-,
57,VNG,VANACHAI GROUP PUBLIC COMPANY LIMITED,SET,PROPCON,CONMAT,
58,VPO,VICHITBHAN PALMOIL PUBLIC COMPANY LIMITED,SET,AGRO,AGRI,
59,VRANDA,VERANDA RESORT PUBLIC COMPANY LIMITED,SET,SERVICE,TOURISM,
60,W,WOW FACTOR PUBLIC COMPANY LIMITED,SET,AGRO,FOOD,
61,WACOAL,THAI WACOAL PUBLIC COMPANY LIMITED,SET,CONSUMP,FASHION,
62,WARRIX,Warrix Sport Public Company Limited,mai,CONSUMP,-,
63,WAVE,WAVE ENTERTAINMENT PUBLIC COMPANY LIMITED,SET,SERVICE,MEDIA,
64,WFX,WORLD FLEX PUBLIC COMPANY LIMITED,SET,CONSUMP,FASHION,
65,WGE,WELL GRADED ENGINEERING PUBLIC COMPANY LIMITED,SET,PROPCON,CONS,
66,WHA,WHA CORPORATION PUBLIC COMPANY LIMITED,SET,PROPCON,PROP,
67,WHABT,WHA BUSINESS COMPLEX FREEHOLD AND LEASEHOLD REAL ESTATE INVESTMENT TRUST,SET,PROPCON,PF&REIT,
68,WHAIR,WHA INDUSTRIAL LEASEHOLD REAL ESTATE INVESTMENT TRUST,SET,PROPCON,PF&REIT,
69,WHART,WHA PREMIUM GROWTH FREEHOLD AND LEASEHOLD REAL ESTATE INVESTMENT TRUST,SET,PROPCON,PF&REIT,
70,WHAUP,WHA UTILITIES AND POWER PUBLIC COMPANY LIMITED,SET,RESOURC,ENERG,
71,WICE,WICE LOGISTICS PUBLIC COMPANY LIMITED,SET,SERVICE,TRANS,
72,WIIK,WIIK PUBLIC COMPANY LIMITED,SET,PROPCON,CONMAT,
73,WIN,WYNCOAST INDUSTRIAL PARK PUBLIC COMPANY LIMITED,SET,PROPCON,PROP,
74,WINMED,WINNERGY MEDICAL PUBLIC COMPANY LIMITED,mai,CONSUMP,-,
75,WINNER,WINNER GROUP ENTERPRISE PUBLIC COMPANY LIMITED,mai,SERVICE,-,
76,WORK,WORKPOINT ENTERTAINMENT PUBLIC COMPANY LIMITED,SET,SERVICE,MEDIA,
77,WORLD,WORLD CORPORATION PUBLIC COMPANY LIMITED,SET,-,REHABCO,
78,WP,WP ENERGY PUBLIC COMPANY LIMITED,SET,RESOURC,ENERG,
79,WPH,WATTANAPAT HOSPITAL TRANG PUBLIC COMPANY LIMITED,SET,SERVICE,HELTH,
80,XO,EXOTIC FOOD PUBLIC COMPANY LIMITED,mai,AGRO,-,
81,XPG,XSPRING CAPITAL PUBLIC COMPANY LIMITED,SET,FINCIAL,FIN,
82,YGG,YGGDRAZIL GROUP PUBLIC COMPANY LIMITED,mai,SERVICE,-,
83,YONG,Yong Concrete Public Company Limited,mai,PROPCON,-,
84,YUASA,YUASA BATTERY (THAILAND) PUBLIC COMPANY LIMITED,mai,INDUS,-,
85,ZEN,ZEN CORPORATION GROUP PUBLIC COMPANY LIMITED,SET,AGRO,FOOD,
86,ZIGA,ZIGA INNOVATION PUBLIC COMPANY LIMITED,mai,INDUS,-,
